Card Name,Type,Attribute,Sub Type,ATK,DEF,Card Text
"Aether, the Empowering Dragon",Effect Monster,LIGHT,Dragon,2300,1600,"When this card is Pendulum Summoned: You can target 1 card on the field; return it to the hand. You can only use this effect of ""Aether, the Empowering Dragon"" once per turn."
"Akz, the Pumer",Effect Monster,EARTH,Beast-Warrior,1500,1000,"This card cannot be Normal Summoned or Set. This card can only be Special Summoned by removing from play 2 Beast-Warrior-Type monsters in your Graveyard. Once per turn, you can discard 1 Beast-Warrior-Type monster from your hand to activate 1 of the following effects:"
,,,,,,Double this card's ATK until the End Phase.
,,,,,,This card can attack your opponent directly this turn.
"Alector, Sovereign of Birds",Effect Monster,WIND,Winged Beast,2400,2000,"If your opponent controls 2 or more face-up monsters of the same Attribute, you can Special Summon this card (from your hand). Once per turn: You can target 1 face-up card on the field; its effect(s) on the field are negated during this turn. There can only be 1 face-up ""Alector, Sovereign of Birds"" on the field."
Alien Mother,Effect Monster,DARK,Reptile,2300,1500,"If this card destroys a monster with an A-Counter by battle and sends it to the Graveyard, Special Summon the destroyed monster to your side of the field at the end of the Battle Phase. When this card is removed from the field, all monsters that were Special Summoned by this card's effect are destroyed."
Alien Overlord,Effect Monster,DARK,Reptile,2200,1600,"You can remove 2 A-Counters from anywhere on the field to Special Summon this card from your hand. Once per turn, you can place 1 A-Counter on each face-up monster your opponent controls. (If a monster with an A-Counter battles an ""Alien"" monster, it loses 300 ATK and DEF for each A-Counter during damage calculation only.) You can only control 1 face-up ""Alien Overlord""."
Ally of Justice Enemy Catcher,Effect Monster,DARK,Machine,1800,1800,"When this card is Normal Summoned, you can gain control of 1 face-down Defense Position monster your opponent controls until the End Phase."
Amazoness Queen,Effect Monster,EARTH,Warrior,2400,1800,Amazoness monsters you control cannot be destroyed by battle.
Ambitious Gofer,Effect Monster,DARK,Fiend,2400,100,"Once per turn, you select up to 2 monsters your opponent controls. Your opponent can reveal 1 monster in their hand to negate this card's effect. If they do not, destroy the selected monsters."
Ancient Gear Beast,Effect Monster,EARTH,Machine,2000,2000,"This card cannot be Special Summoned. The effects of your opponent's Effect Monster that this monster destroys as a result of battle are negated. If this card attacks, your opponent cannot activate any Spell or Trap Cards until the end of the Damage Step."
Ancient Gear Gadjiltron Chimera,Effect Monster,EARTH,Machine,2300,1300,"If you Tribute Summon this card by Tributing 1 of the following monsters, this card gets the appropriate effect:"
,,,,,,Green Gadget: This card gains 300 ATK.
,,,,,,Red Gadget: If this card successfully attacks your opponent directly inflict 500 damage to your opponent.
,,,,,,"Yellow Gadget: If this card destroys your opponent's monster by battle, inflict 700 damage to your opponent."
Angmarl the Fiendish Monarch,Effect Monster,DARK,Fiend,2400,1000,When this card is Tribute Summoned: You can banish 1 Spell Card from your Graveyard; add 1 card with the same name as the banished Spell Card from your Deck to your hand.
Apprentice Illusion Magician,Effect Monster,DARK,Spellcaster,2000,1700,"You can Special Summon this card (from your hand) by discarding 1 card. If this card is Normal or Special Summoned: You can add 1 ""Dark Magician"" from your Deck to your hand. During damage calculation (in either player's turn), if your other DARK Spellcaster-Type monster battles an opponent's monster: You can send this card from your hand or face-up from your field to the Graveyard; that monster you control gains 2000 ATK and DEF during that damage calculation only."
Aquaactress Arowana,Effect Monster,WATER,Aqua,2000,2000,"Once per turn: You can add 1 ""Aquaactress"" monster from your Deck to your hand."
Arcana Force XIV - Temperance,Effect Monster,LIGHT,Fairy,2400,2400,"During damage calculation, in either player's turn: You can discard this card; you take no Battle Damage from that battle. When this card is Summoned: Toss a coin and apply this effect. The effect lasts while this card is face-up on the field."
,,,,,,Heads: Halve all Battle Damage you take.
,,,,,,Tails: Halve all Battle Damage your opponent takes.
Archfiend Commander,Effect Monster,DARK,Fiend,2500,1200,"If you control an ""Archfiend"" card, you can Special Summon this card (from your hand), but it cannot attack this turn. You can only Special Summon ""Archfiend Commander"" once per turn this way. When Special Summoned this way: Target 1 ""Archfiend"" card you control;destroy that target. When this card is Tribute Summoned: You can target 1 Level 6 ""Archfiend"" monster in your Graveyard; Special Summon that target in face-up Defense Position."
Archfiend Giant,Effect Monster,DARK,Fiend,2400,1600,"If this face-up card on the field would be destroyed by a card effect, you can pay 500 Life Points instead. This effect can only be used once while this card is face-up on the field. If this card is destroyed by a card effect and sent to the Graveyard: You can Special Summon 1 ""Archfiend"" monster from your hand."
Archfiend of Gilfer,Effect Monster,DARK,Fiend,2200,2500,"When this card is sent to the Graveyard, you can select 1 monster on the field and equip it with this card. The equipped monster loses 500 ATK."
Armored Axon Kicker,Effect Monster,EARTH,Psychic,2200,1800,"If you control a face-up Psychic-Type monster, you can Normal Summon this card without Tributing. If this card destroys an opponent's monster by battle, you take damage equal to half the destroyed monster's ATK. Then, you can Special Summon 1 monster from the Graveyard with ATK less than or equal to the damage you took."
Aromage Bergamot,Effect Monster,FIRE,Plant,2400,1800,"While your LP is higher than your opponent's, if a Plant-Type monster you control attacks a Defense Position monster, inflict piercing battle damage to your opponent.Once per turn, if you gain LP: This card gains 1000 ATK and DEF until the end of your opponent's turn."
B.E.S. Big Core MK-2,Effect Monster,FIRE,Machine,2400,1100,"If you control no monsters, you can Normal Summon this card without Tributing. When this card is Special Summoned, place 3 counters on it. This card cannot be destroyed by battle. If this card attacks or is attacked, remove 1 counter from this card at the end of the Damage Step. If you cannot, destroy it."
B.E.S. Tetran,Effect Monster,WIND,Machine,1800,2300,"When this card is Normal Summoned, put 3 counters on it. This card cannot be destroyed by battle. If this card attacks or is attacked, remove 1 counter from this card at the end of the Damage Step. If you cannot, destroy it. Once per turn, you can remove 1 counter on this card to destory 1 Spell or Trap Card on the field."
Batteryman Fuel Cell,Effect Monster,LIGHT,Thunder,2100,0,"If you control 2 or more face-up ""Batteryman"" monsters, you can Special Summon this card from your hand. Once per turn, you can Tribute 1 other ""Batteryman"" monster to return 1 card your opponent controls to the owner's hand."
Big Core,Effect Monster,DARK,Machine,2300,1100,"Put 3 counters on this card when you Normal Summon it. This card is not destroyed as a result of battle. If this card battles a monster, remove 1 counter from this card at the end of the Damage Step. If this card battles without a counter, destroy this card at the end of the Damage Step."
Bitelon,Effect Monster,WATER,Reptile,2400,1000,"During battle between this attacking card and a Defense Position monster whose DEF is lower than the ATK of this card, inflict the difference as Battle Damage to your opponent."
Blackwing - Elphin the Raven,Effect Monster,DARK,Winged Beast,2200,1200,"If you control a face-up ""Blackwing"" monster, you can Normal Summon this card without Tributing. When this card is Normal Summoned, you can change the Battle Position of 1 monster your opponent controls."
Blackwing - Simoon the Poison Wind,Effect Monster,DARK,Winged Beast,1600,2000,"If you control no monsters and have this card in your hand: You can banish 1 other ""Blackwing"" monster from your hand; place 1 ""Black Whirlwind"" from your Deck face-up in your Spell & Trap Zone, then, either send this card to the GY, or immediately after this effect resolves ,Normal Summon it without Tributing. You cannot Special Summon monsters from the Extra Deck for the rest of this turn, except DARK monsters. You can only use this effect of ""Blackwing - Simoon the Poison Wind"" once per turn. During the End Phase, send the ""Black Whirlwind"" placed by this effect to the GY, and if you do, take 1000 damage."
Blowback Dragon,Effect Monster,DARK,Machine,2300,1200,"Once per turn, you can toss a coin 3 times. If at least 2 of the results are Heads, destroy 1 card your opponent controls."
Brain Golem,Effect Monster,DARK,Fiend,2500,1800,"Effects of face-up LIGHT monsters are negated. If this card destroys a LIGHT monster by battle, it can attack once again in a row."
Breaker the Dark Magical Warrior,Effect Monster,DARK,Spellcaster,1600,1000,"When this card is Normal Summoned: Place 2 Spell Counters on it. When this card is Pendulum Summoned: Place 3 Spell Counters on it. This card gains 400 ATK for each Spell Counter on it. You can remove 1 Spell Counter from this card, then target 1 Spell/Trap Card on the field; destroy that target. You can only use this effect of ""Breaker the Dark Magical Warrior"" once per turn."
Caius the Shadow Monarch,Effect Monster,DARK,Fiend,2400,1000,"When this card is Tribute Summoned, remove from play 1 card on the field. If it was a DARK Monster Card, inflict 1000 damage to your opponent."
Castle Gate,Effect Monster,EARTH,Rock,0,2400,"This card cannot be destroyed by battle. Once per turn, if this card is in face-up Attack Position, you can Tribute 1 Level 5 or lower monster to inflict damage to your opponent equal to that monster's original ATK."
Chachaka Archer,Effect Monster,WIND,Warrior,1200,1800,Once per turn: You can target 1 Spell/Trap Card on the field; destroy it.
Chaos Betrayer,Effect Monster,DARK,Fiend,2000,2000,"If this card is in your GY: You can banish 1 LIGHT and 1 DARK monster from your GY, except ""Chaos Betrayer""; Special Summon this card in Defense Position, but banish it when it leaves the field. If this card is Special Summoned: You can target 1 card in your opponent's GY; banish it. You can only use each effect of ""Chaos Betrayer"" once per turn."
Chaos Command Magician,Effect Monster,LIGHT,Spellcaster,2400,1900,Negate the effect of a Monster Card that targets this 1 card.
Chaos Sorcerer,Effect Monster,DARK,Spellcaster,2300,2000,Cannot be Normal Summoned/Set. Must first be Special Summoned (from your hand) by banishing 1 LIGHT and 1 DARK monster from your Graveyard. Once per turn: You can target 1 face-up monster on the field: banish that target. This card cannot attack during the turn you activate this effect.
Checksum Dragon,Effect Monster,DARK,Dragon,400,2400,"When an opponent's monster declares an attack: You can Special Summon this card from your hand, then, gain LP equal to half this card's DEF. This Attack Position card cannot be destroyed by battle."
Chronomaly Sol Monolith,Effect Monster,EARTH,Rock,600,600,"Once per turn: You can target 1 ""Chronomaly"" monster you control; its Level becomes 6. You cannot Special Summon any monsters during the turn you activate this effect, except ""Chronomaly"" monsters."
"Commander Gottoms, Swordmaster",Effect Monster,EARTH,Beast-Warrior,2100,1600,"All face-up ""Saber"" monsters you control gain 400 ATK."
Constellar Alrescha,Effect Monster,LIGHT,Warrior,2200,1200,"When this card is Normal Summoned: You can Special Summon 1 ""Constellar"" monster from your hand in face-up Defense Position."
Constellar Antares,Effect Monster,LIGHT,Machine,2400,900,"When this card is Normal or Special Summoned: You can target 1 ""Constellar"" monster in your Graveyard; add that target to your hand."
"Contact ""C""",Effect Monster,EARTH,Insect,1500,2200,"When your opponent Normal or Special Summons a monster(s) (except during the Damage Step): You can Special Summon this card from your hand to the opponent's field in Defense Position. This card's controller cannot Fusion, Synchro, Xyz, or Link Summon unless they use this card as material."
Cranium Fish,Effect Monster,WATER,Fish,2400,1000,You can Special Summon this card by Tributing 1 Ocean's Keeper. You can discard 1 WATER monster to the Graveyard to destroy 1 face-down card.
Criosphinx,Effect Monster,EARTH,Rock,1200,2400,"While this card is face-up on your side of the field, when a monster is returned from the field to the owner's hand, the owner of the returned monster selects 1 card in their hand and sends it to the Graveyard."
Cyber Barrier Dragon,Effect Monster,LIGHT,Machine,800,2800,"This card cannot be Normal Summoned or Set. This card cannot be Special Summoned except with ""Attack Reflector Unit"". While this card is in Attack Position, your opponent's first attack each turn is negated."
Cyber Prima,Effect Monster,LIGHT,Warrior,2300,1600,"When this card is Tribute Summoned, destroy all face-up Spell Cards on the field."
Cybernetic Magician,Effect Monster,LIGHT,Spellcaster,2400,1000,You can discard 1 card to change the ATK of 1 face-up monster to 2000 until the End Phase of this turn.
Cyberse White Hat,Effect Monster,LIGHT,Cyberse,1800,2400,"If you control 2 or more monsters with the same Type, you can Special Summon this card (from your hand). You can only Special Summon ""Cyberse White Hat"" once per turn this way. If this card is sent to the GY as Link Material: You can make all monsters your opponent currently controls lose 1000 ATK until the end of this turn."
Dai-sojo of the Ice Barrier,Effect Monster,WATER,Spellcaster,1600,2200,"When this card is Normal or Flip Summoned, it is changed to Defense Position. Face-up ""Ice Barrier"" monsters you control cannot be destroyed by Spell or Trap Card effects."
Dark Driceratops,Effect Monster,EARTH,Dinosaur,2400,1500,"During battle between this attacking card and a Defense Position monster whose DEF is lower than the ATK of this card, inflict the difference as Battle Damage to your opponent."
Dark Dust Spirit,Effect Monster,EARTH,Zombie,2200,1800,"This card cannot be Special Summoned. During the End Phase of the turn that this card is Normal Summoned or flipped face-up, return it to its owner's hand. When this card is Normal Summoned or flipped face-up, destroy all other face-up monsters."
Dark Lucius LV6,Effect Monster,EARTH,Fiend,1700,600,"If this card was Special Summoned by the effect of ""Dark Lucius LV4"", the effects of your opponent's monsters that this card destroys by battle are negated. During your next Standby Phase after this card has negated your opponent's monster effect, by sending this card to the Graveyard, Special Summon 1 ""Dark Lucius LV8"" from your hand or Deck."
Dark Magician Girl,Effect Monster,DARK,Spellcaster,2000,1700,"This card gains 300 ATK for every ""Dark Magician"" or ""Magician of Black Chaos"" in any Graveyard."
Dark Red Enchanter,Effect Monster,DARK,Spellcaster,1700,2200,"When this card is Normal Summoned, place 2 Spell Counters on it. Each time a Spell Card is activated, place 1 Spell Counter on this card. It gains 300 ATK for each Spell Counter on it. Once per turn, you can remove 2 Spell Counters from this card to make your opponent discard 1 random card."
Dark Ruler Ha Des,Effect Monster,DARK,Fiend,2450,1600,This card cannot be Special Summoned from the Graveyard. Negate the effects of Effect Monsters destroyed by battle with Fiend-Type monsters you control.
Darklord Amdusc,Effect Monster,DARK,Fairy,1800,2800,"You can discard this card and 1 ""Darklord"" card, then target 1 ""Darklord"" card in your Graveyard; add it to your hand. During either player's turn: You can pay 1000 LP, then target 1 ""Darklord"" Spell/Trap Card in your Graveyard; apply that target's effect, then shuffle that target into the Deck. You can only use each effect of ""Darklord Amdusc"" once per turn. You can only Special Summon ""Darklord Amdusc(s)"" once per turn."
Delg the Dark Monarch,Effect Monster,DARK,Spellcaster,2400,1000,"When this card is Normal or Special Summoned, you can select up to 2 cards in your opponent's Graveyard, remove them from play. Then send the same number of cards from the top of their Deck to the Graveyard. During the turn it is Normal or Special Summoned, this card cannot attack."
Des Volstgalph,Effect Monster,EARTH,Dragon,2200,1700,"Each time this card destroys an opponent's monster as a result of battle and sends it to the Graveyard, inflict 500 points of damage to your opponent's Life Points. Also, each time either player activates a Normal or Quick-Play Spell Card, increase the ATK of this card by 200 points until the end of the turn. (This effect is even applied during your opponent's turn.)"
Desert Twister,Effect Monster,WIND,Fiend,2300,2000,"This card cannot be Normal Summoned or Set. This card cannot be Special Summoned except by removing from play 1 EARTH and 2 WIND monsters from your Graveyard. Once per turn, you can discard 1 card to destroy 1 Spell or Trap Card on the field."
Destiny HERO - Dasher,Effect Monster,DARK,Warrior,2100,1000,"Once per turn: You can Tribute 1 other monster; this card gains 1000 ATK until the End Phase. If this card attacks, change it to Defense Position at the end of the Battle Phase. One time only, when you draw a Monster Card during your Draw Phase while this card is in your Graveyard: You can reveal it; Special Summon it. This card must be in the Graveyard to activate and to resolve this effect."
Destiny HERO - Double Dude,Effect Monster,DARK,Warrior,1000,1000,"Cannot be Special Summoned. This card can attack twice during each Battle Phase. During your Standby Phase, if this card was destroyed since your last Standby Phase: You can Special Summon 2 ""Double Dude Tokens"" (Warrior-Type/DARK/Level 4/ATK 1000/DEF 1000). This card must be in your Graveyard to activate and to resolve this effect."
Destiny HERO - Malicious,Effect Monster,DARK,Warrior,800,800,"You can banish this card from your Graveyard; Special Summon 1 ""Destiny HERO - Malicious"" from your Deck."
Dimension Shifter,Effect Monster,DARK,Spellcaster,1200,2200,"If you have no cards in your GY (Quick Effect): You can send this card from your hand to the GY; until the end of the next turn, any card sent to the GY is banished instead."
"Dinomight Knight, the True Dracofighter",Effect Monster,WATER,Wyrm,2500,1200,"To Tribute Summon this card face-up, you can Tribute a Continuous Spell/Trap Card you control, instead of a monster. Once per turn, during either player's turn, when your opponent activates a card or effect while you control this Tribute Summoned monster: You can take 1 ""True Draco"" or ""True King"" Continuous Trap Card from your Deck, and either activate it or add it to your hand."
Dinowrestler Eskrimamenchi,Effect Monster,EARTH,Dinosaur,2200,0,"If you control a ""Dinowrestler"" monster, you can Normal Summon this card without Tributing. During your turn, if your opponent Special Summons a monster(s) while this card is in your GY (except during the Damage Step): You can target 1 Level 4 or lower ""Dinowrestler"" monster in your GY; Special Summon it, then add this card to your hand. You can only use this effect of ""Dinowrestler Eskrimamenchi"" once per turn."
Divine Knight Ishzark,Effect Monster,LIGHT,Warrior,2300,1800,"After damage calculation, when this card destroys a monster by battle. Banish that monster."
Dododo Buster,Effect Monster,EARTH,Warrior,1900,800,"If your opponent controls a monster and you control no monsters, you can Special Summon this card (from your hand). If Summoned this way, its Level becomes 4. When this card is Tribute Summoned: You can target 1 ""Dododo"" monster in your Graveyard; Special Summon that target in face-up Defense Position."
Dododo Warrior,Effect Monster,EARTH,Warrior,2300,900,"You can Normal Summon this card without Tributing, but its original ATK becomes 1800. If this card attacks, negate all card effects that activate in the opponent's Graveyard, until the end of the Damage Step."
Dragon Queen of Tragic Endings,Effect Monster,DARK,Dragon,1900,2600,"This card cannot be Normal Summoned or Set. This card can only be Special Summoned by controlling 3 or more face-up Continuous Spell Cards. When this attacking card inflicts Battle Damage to your opponent, your opponent selects and sends 1 card from their hand to the Graveyard, and you draw 1 card. During your Standby Phase, if this card is in your Graveyard and was sent there from the field, you can send 1 face-up Continuous Spell Card you control to the Graveyard to Special Summon this card from the Graveyard."
Dragon Seeker,Effect Monster,DARK,Fiend,2000,2100,"When this card is Summoned (excluding Special Summon), destroy 1 face-up Dragon-Type monster on the field."
Dragunity Arma Mystletainn,Effect Monster,WIND,Dragon,2100,1500,"You can Special Summon this card from your hand by sending 1 face-up ""Dragunity"" monster you control to the Graveyard. When this card is Normal or Special Summoned from the hand, you can select 1 Dragon-Type ""Dragunity"" monster in your Graveyard, and equip it to this card."
"Dreiath III, the True Dracocavalry General",Effect Monster,EARTH,Wyrm,2100,2800,"To Tribute Summon this card face-up, you can Tribute a Continuous Spell/Trap Card you control, instead of a monster. Your opponent cannot target face-up ""True Draco"" or ""True King"" monsters on the field with card effects, except this one, also they cannot be destroyed by your opponent's card effects. If this face-up Tribute Summoned monster leaves the field: You can Special Summon 1 ""True Draco"" or ""True King"" monster from your Deck in Defense Position."
"Dyna, Hero Fur Hire",Effect Monster,EARTH,Beast-Warrior,2500,1400,"If this card is Special Summoned: You can banish cards from your opponent's GY, up to the number of monsters ""Fur Hire"" you control with different names. You can only use this effect of ""Dyna, Hero Fur Hire"" once per turn. Monsters your opponent controls cannot target monsters ""Fur Hire"" for attacks, except this one."
Elemental HERO Poison Rose,Effect Monster,EARTH,Plant,1900,2000,"Cannot be Normal Summoned or Set. Must be Special Summoned with ""Rose Bud"" and cannot be Special Summoned by other ways. Each time this card inflicts Battle Damage to your opponent: It gains 200 ATK and loses 200 DEF. Your opponent can only target ""Elemental HERO Poison Rose"" for attacks."
Elementsaber Lapauila Mana,Effect Monster,LIGHT,Warrior,2400,2100,"You can send 2 other monsters from your hand to the GY; Special Summon this card from your hand. You can only use this effect of ""Elementsaber Lapauila Mana"" once per turn. Apply the appropriate effects to ""Elementsaber"" and ""Elemental Lord"" monsters you control, depending on the original Attributes of the ""Elementsaber"" monsters sent to the GY to activate this card's effect."
,,,,,,EARTH or WIND: They cannot be destroyed by battle.
,,,,,,WATER or FIRE: They cannot be destroyed by card effects.
,,,,,,LIGHT or DARK: Your opponent cannot target them with card effects.
"Enishi, Shien's Chancellor",Effect Monster,LIGHT,Warrior,2200,1200,"Cannot be Normal Summoned or Set. Must be Special Summoned (from your hand) by banishing 2 ""Six Samurai"" monsters from your Graveyard, and cannot be Special Summoned by other ways. Once per turn: You can target 1 face-up monster; destroy that target. This card cannot declare an attack the turn you activate this effect."
Erica the Rikka Fairy,Effect Monster,WATER,Plant,2400,1000,"When an attack is declared involving another Plant monster you control: You can Tribute this card from your hand or face-up field; that monster you control gains 1000 ATK/DEF until the end of this turn. If a Plant monster(s) you control is Tributed, while this card is in your GY (except during the Damage Step): You can Special Summon this card in Defense Position, but banish it when it leaves the field. You can only use each effect of ""Erica the Rikka Fairy"" once per turn."
Evilswarm Coppelia,Effect Monster,DARK,Machine,2450,2050,Cannot be Special Summoned. When this card leaves the field because of your opponent's card (either by battle or by card effect): You can target 1 face-up monster your opponent controls; take control of that target until your next End Phase.
Evolsaur Elias,Effect Monster,FIRE,Dinosaur,100,2400,"When this card is Special Summoned by the effect of an ""Evoltile"" monster: You can Special Summon 1 Level 6 or lower FIRE Dinosaur-Type monster from your hand."
Evolsaur Terias,Effect Monster,FIRE,Dinosaur,2400,600,"When this card is Special Summoned by the effect of an ""Evoltile"" monster: This card loses 500 ATK."
F.A. Turbo Charger,Effect Monster,WIND,Machine,0,1500,"Gains ATK equal to its Level x 300. Your opponent's monsters whose original Level/Rank is lower than this card's Level cannot target monsters for attacks, except this one. Your opponent cannot target monsters, except this one, with the effects of monsters whose original Level/Rank is lower than this card's Level. Each time a ""F.A."" Spell/Trap Card or effect is activated: You can increase this card's Level by 1. If your ""F.A."" monster battles while you control this Level 7 or higher card, your opponent's monsters cannot activate their effects until the end of the Damage Step."
