Card Name,Type,Attribute,Sub Type,ATK,DEF,Card Text
Mekk-Knight Green Horizon,Effect Monster,LIGHT,Psychic,2100,1600,"If 2 or more cards are in the same column, you can Special Summon this card (from your hand) in that column. You can only Special Summon ""Mekk-Knight Green Horizon"" once per turn this way. When an attack is declared involved this card and an opponent's monster in this card's column: You can target 1 ""Mekk-Knight"" monster in your GY; add it to your hand."
Mekk-Knight Orange Sunset,Effect Monster,LIGHT,Psychic,800,3000,"If 2 or more cards are in the same column, you can Special Summon this card (from your hand) in that column. You can only Special Summon ""Mekk-Knight Orange Sunset"" once per turn this way. If an opponent's card in this card's column is destroyed by battle, or leaves the field: You can Special Summon 1 ""Mekk-Knight"" monster from your hand."
Mind on Air,Effect Monster,DARK,Spellcaster,1000,1600,"As long as this card remains face-up on the field, your opponent must continue to show his/her hand."
Minoan Centaur,Effect Monster,EARTH,Beast-Warrior,1800,1000,This card cannot be Special Summoned. You can Tribute this card to Special Summon 2 Level 4 Beast-Type Normal Monsters from your Deck.
Mobius the Frost Monarch,Effect Monster,WATER,Aqua,2400,1000,"When this card is Tribute Summoned, you can select up to 2 Spell or Trap Cards on the field. Destroy them."
Mother Spider,Effect Monster,EARTH,Insect,2300,1200,"If you have only Insect-Type monsters in your Graveyard, you can send 2 face-up Defense Position monsters your opponent controls to the Graveyard and Special Summon this card from your hand."
Mudan the Rikka Fairy,Effect Monster,WATER,Plant,1000,2400,"You can Tribute 1 Plant monster; Special Summon this card from your hand. If this card is Normal Summoned, or Special Summoned by the effect of a Plant monster: You can add 1 ""Rikka"" Spell/Trap from your Deck to your hand. You can only use each effect of ""Mudan the Rikka Fairy"" once per turn."
Mutant Mindmaster,Effect Monster,DARK,Spellcaster,0,2500,"When this card declares an attack, you can take control of 1 face-up Attack Position monster your opponent controls, and attack with it instead of this monster. It cannot attack your opponent directly. Return it to your opponent at the end of the Battle Phase."
Mystic Swordsman LV6,Effect Monster,EARTH,Warrior,2300,1700,"If you Normal Summon this card, you must place it in face-down Defense Position. If this card attacks a face-down Defense Position monster, destroy the monster immediately with this card's effect without flipping it face-up or applying damage calculation. You can return the monster destroyed with this effect to the top of its owner's Deck, instead of sending it to the Graveyard."
Mystical Beast of Serket,Effect Monster,EARTH,Fairy,2500,2000,"Destroy this card if you do not control ""Temple of the Kings"". Each time this card destroys a monster by battle, the destroyed monster is removed from play, and this card gains 500 ATK."
Naturia Stag Beetle,Effect Monster,EARTH,Insect,2200,1500,"Once per turn, during the Battle Step or Damage Step of this card's attack, when your opponent activates a card or effect, you can select 1 ""Naturia"" monster in your Graveyard. Special Summon that monster from the Graveyard."
Neo Kaiser Glider,Effect Monster,LIGHT,Dragon,2400,2200,"You can discard this card and 1 monster, then target 1 Dragon Normal Monster in your GY; Special Summon it. If this card is sent to the GY: You can make all monsters your opponent currently controls lose 500 ATK until the end of this turn. You can only use each effect of ""Neo Kaiser Glider"" once per turn."
Nine-Tailed Fox,Effect Monster,FIRE,Zombie,2200,2000,"If this card is in your hand or GY: You can Tribute 2 monsters; Special Summon this card. You can only use this effect of ""Nine-Tailed Fox"" once per turn. If this card that was Special Summoned from the GY attacks a Defense Position monster, inflict piercing battle damage. If this card is destroyed by battle or card effect and sent to the GY: You can Special Summon 2 ""Fox Tokens"" (Zombie/FIRE/Level 2/ATK 500/DEF 500)."
Overdrive Teleporter,Effect Monster,LIGHT,Psychic,2100,1200,This card cannot be Special Summoned. You can pay 2000 Life Points to Special Summon 2 Level 3 Psychic-Type monsters from your Deck. This effect can only be used once while this card is face-up on the field.
Palladium Oracle Mana,Effect Monster,LIGHT,Spellcaster,2000,1700,"When your opponent activates a card or effect that targets 1 Spellcaster monster you control (and no other cards), while this card is in your hand or GY (Quick Effect): You can Special Summon this card. You can only use this effect of ""Palladium Oracle Mana"" once per turn. Level 7 or higher Spellcaster monsters you control cannot be destroyed by card effects. If this card is destroyed by battle or card effect: You can Special Summon 1 ""Dark Magician Girl"" from your hand, Deck, or GY."
Parry Knights,Effect Monster,EARTH,Warrior,2300,2100,"When you take battle damage from an opponent's attacking monster: You can Special Summon this card from your hand, then you can Special Summon 1 monster from your hand with ATK less than or equal to the damage you took."
Penumbral Soldier Lady,Effect Monster,DARK,Warrior,2100,1400,"If this card battles with a LIGHT monster, increase the ATK of this card by 1000 points during the Damage Step."
Performage Stilts Launcher,Effect Monster,EARTH,Spellcaster,2200,0,"If there are no monsters on the field, you can Special Summon this card (from your hand), but you cannot Normal Summon/Set for the rest of this turn. During either player's turn, when a card or effect is activated that would inflict damage to your opponent while you have another ""Performage"" monster in your Graveyard: You can banish this card from your Graveyard; inflict 2000 damage to your opponent. You can only use this effect of ""Performage Stilts Launcher"" once per turn."
Performapal Clay Breaker,Effect Monster,EARTH,Warrior,2000,1000,"If this Tribute Summoned card battles an opponent's monster, during damage calculation: You can make that opponent's monster lose 500 ATK for each face-up Pendulum Monster currently in your Extra Deck, until the end of this turn. When you Pendulum Summon 2 or more monsters at the same time while this card is in your GY: You can add this card from the GY to your hand. You can only use each effect of ""Performapal Clay Breaker"" once per turn."
Performapal Elephammer,Effect Monster,EARTH,Beast,2600,1800,"If you control 2 or more ""Performapal"" cards, you can Normal Summon this card without Tributing. Cannot attack unless you control another ""Performapal"" card. When this card declares an attack: You can return all Spell and Trap Cards your opponent controls to the hand."
Performapal Inflater Tapir,Effect Monster,WIND,Beast,1000,2000,"During damage calculation (in either player's turn), if a monster you control battles an opponent's monster: You can discard this card; neither player takes any battle damage from that battle. When an opponent's monster declares a direct attack while this card is in your Graveyard: You can discard 1 ""Performapal"" monster; Special Summon this card in Defense Position. You can only use this effect of ""Performapal Inflater Tapir"" once per turn."
Phantom Bounzer,Effect Monster,DARK,Warrior,2400,1200,"If this card on the field is destroyed and sent to the Graveyard: You can add 2 ""Bounzer"" cards from your Deck to your hand."
Phoenix Beast Gairuda,Effect Monster,WIND,Winged Beast,2500,1200,"If this card attacks an opponent's monster, this card gains 300 ATK during the Damage Step only."
Photon Leo,Effect Monster,LIGHT,Beast,2100,1100,"When this card is Normal Summoned: You can have your opponent shuffle their entire hand into the Deck, then they draw the same number of cards as they shuffled into the Deck."
Power Giant,Effect Monster,EARTH,Rock,2200,0,"You can Special Summon this card (from your hand) by sending 1 Level 4 or lower monster from your hand to the Graveyard. If you do, decrease this card's Level by the Level of that monster. If this card attacks or is attacked, until the end of the Damage Step any effect damage you take becomes 0."
Prime Material Dragon,Effect Monster,LIGHT,Dragon,2400,2000,"Any effect that would inflict damage to a player increases their Life Points by the same amount, instead. During either player's turn, when a Spell, Trap, Spell/Trap effect, or Effect Monster's effect is activated that would destroy a monster(s) on the field: You can send 1 card from your hand to the Graveyard; negate the activation and destroy it."
Prophecy Destroyer,Effect Monster,DARK,Spellcaster,2500,1200,"If this card is in your Graveyard: You can banish 3 ""Spellbook"" Spell Cards from your Graveyard; Special Summon this card from your Graveyard."
PSY-Frame Multi-Threader,Effect Monster,LIGHT,Psychic,0,2500,"This card's name becomes ""PSY-Frame Driver"" while it is in the hand or Graveyard. If a ""PSY-Frame"" card(s) you control would be destroyed by battle or card effect, you can discard this card instead. If a ""PSY-Frame"" Tuner is Special Summoned to your field, while this card is in your Graveyard (except during the Damage Step): You can Special Summon this card, but banish it when it leaves the field. You can only use this effect of ""PSY-Frame Multi-Threader"" once per turn."
Psychic Emperor,Effect Monster,LIGHT,Psychic,2400,1000,"When this card is Normal or Special Summoned, gain 500 Life Points for each Psychic-Type monster in your Graveyard."
Pumpking the King of Ghosts,Effect Monster,DARK,Zombie,1800,2000,"If ""Castle of Dark Illusions"" is face-up on the Field, increase the ATK and DEF of this card by 900 points. As long this ""Castle of Dark Illusions"" remains face-up on the Field, the ATK and DEF of this card continues to increase by 100 points during each of your Standby Phases. This effect continues until your 4th turn after this card is activated."
Puppet Master,Effect Monster,DARK,Fiend,0,0,"When this card is Tribute Summoned, you can pay 2000 Life Points to select 2 Fiend-Type monsters from your Graveyard and Special Summon them. They cannot attack this turn."
Raidraptor - Wild Vulture,Effect Monster,DARK,Winged Beast,1600,2000,"During your Main Phase, if this card was Normal or Special Summoned this turn: You can Tribute this card; Special Summon 2 ""Raidraptor"" monsters from your hand and/or Graveyard whose total Levels equal 6."
Raiza the Storm Monarch,Effect Monster,WIND,Winged Beast,2400,1000,"When this card is Tribute Summoned, return 1 card on the field to the top of its owner's Deck."
Reaper of Prophecy,Effect Monster,DARK,Spellcaster,2000,1600,"When this card is Normal or Special Summoned: You can activate this effect; apply as many effects as possible, based on the number of ""Spellbook"" Spell Cards with different names in your Graveyard. You can only use the effect of ""Reaper of Prophecy"" once per turn."
,,,,,,3 or more: This card gains 600 ATK.
,,,,,,"4 or more: Add 1 ""Spellbook"" Spell Card from your Deck to your hand."
,,,,,,5 or more: Special Summon 1 Level 5 or higher DARK Spellcaster-Type monster from your Deck.
Red Dragon Ninja,Effect Monster,FIRE,Winged Beast,2400,1200,"When this card is Summoned: You can banish 1 ""Ninja"" or ""Ninjitsu Art"" card from your Graveyard to target 1 Set card your opponent controls; reveal that Set card, then return it to either the top or bottom of the Deck. Your opponent cannot activate the targeted card in response to this effect's activation. You can only use the effect of ""Red Dragon Ninja"" once per turn."
Red Warg,Effect Monster,FIRE,Fiend,1400,2200,"When you Normal Summon a ""Resonator"" monster: You can Special Summon this card from your hand, but its ATK becomes halved."
Reptilianne Medusa,Effect Monster,DARK,Reptile,2200,800,"Send 1 card from your hand to the Graveyard and select 1 face-up monster your opponent controls. The ATK of the selected monster becomes 0, and it cannot change its battle position."
Rescueroid,Effect Monster,FIRE,Machine,1600,1800,"When a ""roid"" monster you control is destroyed by battle and sent to the Graveyard, you can return that monster to its owner's hand."
Roc from the Valley of Haze,Effect Monster,WIND,Winged Beast,2400,1400,"When this card is sent directly from your hand to the Graveyard, add this card to the Deck and shuffle it."
Rose Tentacles,Effect Monster,EARTH,Plant,2200,1200,"This card cannot be Special Summoned. At the beginning of your Battle Phase, this card gains 1 additional attack this turn for each face-up Plant-Type monster your opponent controls. Each time this card destroys a Plant-Type monster by battle, inflict 300 damage to your opponent."
Ryu Kokki,Effect Monster,DARK,Zombie,2400,2000,"At the end of the Damage Step, if this card battled a Warrior or Spellcaster-Type monster: Destroy that monster."
Saber Beetle,Effect Monster,EARTH,Insect,2400,600,"During battle between this attacking card and a Defense Position monster whose DEF is lower than the ATK of this card, inflict the difference as Battle Damage to your opponent."
Salvagent Driver,Effect Monster,LIGHT,Cyberse,2200,2100,"If a Cyberse Link Monster you control is destroyed by an opponent's card effect while this card is in your hand or GY (except during the Damage Step): You can Special Summon this card. You can discard 1 Spell, then target 1 Cyberse monster in your GY; Special Summon it, but it cannot attack directly this turn. You can only use each effect of ""Salvagent Driver"" once per turn."
Santa Claws,Effect Monster,LIGHT,Fiend,1200,2500,"You can Special Summon this card (from your hand) to your opponent's side of the field inDefense Position, by Tributing 1 monster they control. If Summoned this way, during the End Phase of this turn: You can draw 1 card."
Scary Moth,Effect Monster,WIND,Insect,1800,2300,Each player can only Special Summon a monster(s) once per turn.
Scrap Breaker,Effect Monster,EARTH,Machine,2100,700,"If your opponent controls a monster, you can Special Summon this card from your hand. When this card is Special Summoned this way, select 1 face-up ""Scrap"" monster you control, and destroy it."
Senior Silver Ninja,Effect Monster,EARTH,Warrior,2300,2200,"When this card is flipped face-up: You can Special Summon any number of ""Ninja"" monsters, except ""Senior Silver Ninja"", from your hand and/or Graveyard in face-down Defense Position. There can only be 1 face-up ""Senior Silver Ninja"" on the field."
Sharkraken,Effect Monster,WATER,Fish,2400,2100,You can Special Summon this card (from your hand) by Tributing 1 WATER monster.
Skull Archfiend of Lightning,Effect Monster,DARK,Fiend,2500,1200,"The controller of this card pays 500 Life Points during each of his/her Standby Phases (this is not optional). When this card is targeted by the effect of a card controlled by your opponent, when resolving the effect, roll a six-sided die. If the result is 1, 3 or 6, negate the effect and destroy the opponent's card."
Sky Scourge Invicil,Effect Monster,EARTH,Fairy,2200,1600,"This card cannot be Special Summoned. If you Tribute Summon this card by Tributing 1 of the following monsters, this card gets the appropriate effect: + LIGHT Fairy Type monster. Negate the effect of all Spell Cards. + DARK Fiend Type monster: Negate the effects of all Trap Cards."
Soul of Purity and Light,Effect Monster,LIGHT,Fairy,2000,1800,This card cannot be Normal Summoned or Set. This card can only be Special Summoned by removing from play 2 LIGHT monsters from your Graveyard. All monsters your opponent controls lose 300 ATK during their Battle Phase only.
Speedburst Dragon,Effect Monster,DARK,Dragon,2400,600,"When you take effect damage (except during the Damage Step): You can Special Summon this card from your hand, then inflict damage to your opponent equal to the damage you took, and if you do, you gain LP equal to half that damage you inflicted. When this card is Tribute Summoned: You can add 2 ""Rokket"" monsters with different names from your Deck to your hand. You can only use each effect of ""Speedburst Dragon"" once per turn."
Spirit of the Pharaoh,Effect Monster,LIGHT,Zombie,2500,2000,"This card cannot be Normal Summoned or Set. This card cannot be Special Summoned except by the effect of The First Sarcophagus"". When this card is Special Summoned, you can Special Summon up to 4 Level 2 or lower Zombie-Type Normal Monsters from your Graveyard."""
Steelswarm Moth,Effect Monster,DARK,Fiend,2400,0,"When this card is Tribute Summoned by Tributing 1 ""Steelswarm"" monster: You can pay 1000 Life Points to target up to 2 cards your opponent controls; return them to the hand."
Stegocyber,Effect Monster,DARK,Dinosaur,1200,2400,"During your opponent's turn, at damage calculation, if this card is in your Graveyard: You can pay 1000 LP; Special Summon it, and if you do, you take no battle damage from that battle, and banish this card when it leaves the field (this is a Quick Effect). You can only use this effect of ""Stegocyber"" once per turn."
Storm Caller,Effect Monster,WIND,Psychic,2300,2000,"You can put your opponent's monsters that are destroyed by battle with other Psychic-Type monsters on top of their owner's Deck instead of sending them to the Graveyard. When this card is destroyed by a card effect, this card's controller takes Damage equal to its original ATK."
Strong Wind Dragon,Effect Monster,WIND,Dragon,2400,1000,"This card cannot be destroyed by battle with a monster that has the same ATK. When this card is Tribute Summoned by Tributing a Dragon-Type monster, it gains ATK equal to half the ATK of the Tributed monster. During battle between this attacking card and a Defense Position monster whose DEF is lower than the ATK of this card, inflict the difference as Battle Damage to your opponent."
Swift Birdman Joe,Effect Monster,WIND,Winged Beast,2300,1400,"If you Tribute Summon this card by Tributing a WIND monster, return all Spell and Trap Cards on the field to the owners' hands."
Sylvan Guardioak,Effect Monster,EARTH,Plant,2400,1500,"Once per turn: You can choose a number from 1 to 3, then excavate that many cards from the top of your Deck, send any excavated Plant-Type monsters to the Graveyard, also place the other cards on the bottom of your Deck in any order. If this card is excavated from the Deck and sent to the Graveyard by a card effect: You can target 1 other Plant-Type monster in your Graveyard; place that target on top of your Deck."
The Agent of Judgment - Saturn,Effect Monster,LIGHT,Fairy,2400,0,"While your Life Points are higher than your opponent's, you can Tribute this card to inflict damage to your opponent equal to the difference. If you do not control ""The Sanctuary in the Sky"", this effect is not applied. You cannot conduct your Battle Phase the turn you activate this effect."
The End of Anubis,Effect Monster,DARK,Fiend,2500,0,"As long as this card remains face-up on the field, all effects of Spell, Trap, and Effect Monster Cards that target a card(s) in the Graveyard or that activate in the Graveyard are negated."
The Fiend Megacyber,Effect Monster,DARK,Warrior,2200,1200,"If your opponent controls at least 2 more monsters than you do, you can Special Summon this card (from your hand)."
The Weather Painter Aurora,Effect Monster,DARK,Fairy,2200,2000,"When this card is Normal Summoned: You can place 1 ""The Weather"" Spell/Trap from your hand, Deck, or GY face-up in your Spell & Trap Zone. Your opponent cannot target ""The Weather"" Spells/Traps you control with card effects, also they cannot be destroyed by your opponent's card effects. Once per turn, during the Standby Phase of the turn after this card was banished from the field to activate a ""The Weather"" card's effect: You can Special Summon this banished card."
Thestalos the Firestorm Monarch,Effect Monster,FIRE,Pyro,2400,1000,"When this card is Tribute Summoned, discard 1 random card from your opponent's hand. If it was a Monster Card, inflict damage to your opponent equeal to it's level x 100."
Thunder Dragonhawk,Effect Monster,LIGHT,Thunder,1800,2200,"You can discard this card; Special Summon 1 of your ""Thunder Dragon"" monster that is banished or in your GY, except ""Thunder Dragonhawk"". If this card is banished, or sent from the field to the GY: You can shuffle any number of cards from your hand into the Deck, then draw the same number of cards. You can only use 1 ""Thunder Dragonhawk"" effect per turn, and only once that turn."
Thunder Dragonroar,Effect Monster,DARK,Thunder,2400,0,"You can discard this card; add to your hand, 1 of your ""Thunder Dragon"" cards that is banished or in your GY, except ""Thunder Dragonroar"". If this card is banished, or sent from the field to the GY: You can Special Summon 1 ""Thunder Dragon"" monster from your Deck in Defense Position, but return it to the hand during the End Phase. You can only use 1 ""Thunder Dragonroar"" effect per turn, and only once that turn."
Tiger Dragon,Effect Monster,EARTH,Dragon,2400,1800,"If this card is Tribute Summoned by Tributing a Dragon-Type monster, you can destroy up to 2 face-down Spell and Trap Cards your opponent controls."
Timeater,Effect Monster,DARK,Machine,1900,1700,"If this monster destroys a monster on your opponent's side of the field in battle, your opponent skips his/her next Main Phase 1."
Tongue Twister,Effect Monster,DARK,Fiend,400,300,"If this card was Tribute Summoned, when it is sent from the field to the Graveyard, draw 2 cards and remove this card from play."
Total Defense Shogun,Effect Monster,DARK,Warrior,1550,2500,"This card is changed to Defense Position when it is Normal Summoned or Flip Summoned successfully. This card can attack while it is in Defense Position. If this card attacks while in Defense Position, apply the ATK of this card for damage calculation."
Trifortressops,Effect Monster,DARK,Machine,1600,2800,"During either player's turn, if your opponent Summoned 3 or more monsters this turn: You can Special Summon this card from your hand. If this card is Special Summoned this way, it is unaffected by other card effects, but loses 500 DEF during each player's Standby Phase."
Troposphere,Effect Monster,WIND,Winged Beast,2400,2000,"If you Tribute Summon this card, the Tribute must be Winged Beast-Type. This card is unaffected by the effects of Trap Cards."
"Twilight Ninja Nichirin, the Chunin",Effect Monster,DARK,Warrior,2300,1000,"Once per turn, during either player's turn: You can discard 1 ""Ninja"" monster, then activate 1 of these effects;"
,,,,,,"This turn, ""Ninja"" monsters and ""Ninjitsu Art"" cards you control cannot be destroyed by battle or card effects."
,,,,,,"1 ""Ninja"" monster you control gains 1000 ATK until the end of this turn."
Twinheaded Beast,Effect Monster,FIRE,Beast,1700,1900,This card can attack twice during the same Battle Phase.
U.A. Goalkeeper,Effect Monster,EARTH,Warrior,1000,2800,"You can Special Summon this card (from your hand) by returning 1 ""U.A."" monster you control to the hand, except ""U.A. Goalkeeper"". You can only Special Summon ""U.A. Goalkeeper"" once per turn this way. Once per turn, during your opponent's turn: You can target 1 ""U.A."" monster you control; once during this turn, it cannot be destroyed by battle or card effects (this is a Quick Effect)."
U.A. Rival Rebounder,Effect Monster,EARTH,Warrior,2200,2300,"You can Special Summon this card (from your hand) by returning 1 ""U.A."" monster you control to the hand, except ""U.A. Rival Rebounder"". You can only Special Summon ""U.A. Rival Rebounder"" once per turn this way. If this card is Special Summoned during your opponent's turn, or Normal Summoned: You can Special Summon 1 ""U.A."" monster from your hand or Graveyard, except ""U.A. Rival Rebounder"". You can only use this effect of ""U.A. Rival Rebounder"" once per turn."
UFOroid,Effect Monster,LIGHT,Machine,1200,1200,"When this card is destroyed as a result of battle and sent to the Graveyard, you can Special Summon from your Deck 1 Machine-Type monster with an ATK of 1500 or less in face-up Attack Position. Then shuffle your Deck."
Valkyrie Erste,Effect Monster,LIGHT,Fairy,1600,1800,"If this card is Special Summoned from your hand by a Spell effect: You can target 1 ""Mischief of the Time Goddess"" in your GY: add it to your hand. If you control a ""Valkyrie"" monster other than ""Valkyrie Erste"" (Quick Effect): You can banish 1 monster from your opponent's GY, then this card's ATK becomes equal to the banished monster's original ATK, until the end of this turn. You can only use each effect of ""Valkyrie Erste"" once per turn."
Vampire Grace,Effect Monster,DARK,Zombie,2000,1200,"When a Level 5 or higher Zombie-Type monster(s) is Special Summoned to your side of the field by the effect of a Zombie-Type monster while this card is in your Graveyard: You can pay 2000 Life Points; Special Summon this card from your Graveyard. You can only use this effect of ""Vampire Grace"" once per turn. Once per turn: You can declare 1 card type (Monster, Spell, or Trap); your opponent sends 1 card of that type from their Deck to the Graveyard."
Vampire Red Baron,Effect Monster,DARK,Zombie,2400,1000,"Once per turn: You can pay 1000 LP, then target 1 monster your opponent controls and 1 other ""Vampire"" monster you control; switch control of those monsters. At the end of the Battle Phase, if this card destroyed any monster(s) by battle: You can Special Summon them from the GYs to your field."
