Card Name,Type,Attribute   ,Sub Type    ,ATK    ,DEF    ,Card Text
Abominable Unchained Soul,Effect Monster,DARK,Fiend,3000,1500,"You can only Special Summon ""Abominable Unchained Soul(s)"" once per turn. If a card(s) you control is destroyed by battle or card effect: You can Special Summon this card from your hand. If this card is Special Summoned: You can discard 1 card; destroy 1 card on the field. Once per turn, during the End Phase, if this card is in the GY because it was destroyed on the field and sent there this turn: You can Special Summon this card, but place it on the bottom of the Deck when it leaves the field."
Ally of Justice Cosmic Gateway,Effect Monster,DARK,Machine,2400,1200,"If your opponent controls 2 or more monsters, including a LIGHT monster, you can Special Summon this card from your hand."
Ally of Justice Thunder Armor,Effect Monster,DARK,Machine,2700,2200,"This card cannot be Special Summoned. While you control this face-up card, during battle between an attacking ""Ally of Justice"" monster you control and a Defense Position monster whose DEF is lower than the ATK of the attacking monster, inflict the difference as Battle Damage to your opponent."
Ancient Gear Gadjiltron Dragon,Effect Monster,EARTH,Machine,3000,2000,"If this card attacks, your opponent cannot activate any Spell/Trap Cards until the end of the Damage Step. This card gets extra effects if you Tribute Summon it by Tributing"
,,,,,,"Green Gadget: During battle between this attacking card and a Defense Position monster whose DEF is lower than the ATK of this card, inflict the difference as Battle Damage to your opponent."
,,,,,,"Red Gadget: When this card inflicts Battle Damage to your opponent, inflict 400 damage to your opponent."
,,,,,,"Yellow Gadget: If this card destroys your opponent's monster by battle, inflict 600 damage to your opponent."
Ancient Gear Golem,Effect Monster,EARTH,Machine,3000,3000,"Cannot be Special Summoned. If this card attacks a Defense Position monster, inflict piercing Battle Damage to your opponent. If this card attacks, your opponent cannot activate any Spell/Trap Cards until the end of the Damage Step."
Ancient Gear Golem - Ultimate Pound,Effect Monster,EARTH,Machine,3000,3000,"Cannot be Special Summoned. If this card attacks a Defense Position monster, inflict piercing battle damage. Up to twice per turn, when this attacking card destroys a monster by battle: You can discard 1 Machine monster; this card can attack again in a row. If this card on the field is destroyed by battle or card effect: You can add 1 ""Polymerization"" from your Deck to your hand, and if you do, add 1 other ""Ancient Gear"" monster from your GY to your hand."
Arcana Force XXI - The World,Effect Monster,LIGHT,Fairy,3100,3100,"When this card is Summoned, toss a coin: * Heads: During your End Phase, you can send 2 monsters you control to the Graveyard to skip your opponent's next turn. * Tails: During your opponent's Draw Phase, add the top card of their Graveyard to their hand."
"Archfiend Emperor, the First Lord of Horror",Effect Monster,DARK,Fiend,3000,2000,"You can Normal Summon this card without Tributing, but its original ATK and DEF become halved. If Summoned this way, it is destroyed during the End Phase. You cannot Special Summon any monsters, except Fiend-Type monsters. Once per turn: You can banish 1 ""Archfiend"" card from your hand or Graveyard, then target 1 card on the field; destroy that target."
Archfiend Empress,Effect Monster,DARK,Fiend,2900,2100,"If (exactly) 1 face-up DARK Fiend-Type monster on the field, except this card, would be destroyed, you can remove from play 1 DARK Fiend-Type monster from your Graveyard, instead. When this card is destroyed and sent from the field to the Graveyard, you can select 1 Level 6 or higher DARK Fiend-Type monster in your Graveyard, except ""Archfiend Empress"", and Special Summon it."
Archlord Kristya,Effect Monster,LIGHT,Fairy,2800,2300,"If you have exactly 4 Fairy-Type monsters in your Graveyard, you can Special Summon this card (from your hand). When you do: Target 1 Fairy-Type monster in your Graveyard; add that target to your hand. Neither player can Special Summon monsters. If this face-up card would be sent from the field to the Graveyard, it returns to the top of the Deck, instead."
Archlord Zerato,Effect Monster,LIGHT,Fairy,2800,2300,"This card cannot be Normal Summoned or Set. This card cannot be Special Summoned except by Tributing 1 face-up Warrior of Zera"" on your side of the field while ""The Sanctuary in the Sky"" is on the field. If ""The Sanctuary in the Sky"" is on your side of the field, by discarding 1 LIGHT Monster Card from your hand to the Graveyard, destroy all monsters on your opponent's side of the field. If ""The Sanctuary in the Sky"" is not on your side of the field, this effect is not applied."""
Armed Protector Dragon,Effect Monster,LIGHT,Dragon,2000,2800,Face-up Equip Cards you control cannot be destroyed by card effects. This card gains 500 ATK for each Equip Card equipped to this card.
Armoroid,Effect Monster,EARTH,Machine,2700,2000,"When you Tribute Summoned this card by Tributing at least 1 ""roid"" monster, remove from play all Spell and Trap Cards on the field."
B.E.S. Big Core MK-3,Effect Monster,LIGHT,Machine,2700,1900,"If your opponent controls a monster and you control no monsters, you can Special Summon this card (from your hand) in Defense Position. If this card is Normal or Special Summoned: Place 3 counters on this card. Cannot be destroyed by battle. At the end of the Damage Step, if this card battles a monster: Remove 1 counter from this card. If you cannot, destroy it. You can banish this card from your Graveyard; shuffle all ""B.E.S."" monsters from your Graveyard into the Deck."
Batteryman Industrial Strength,Effect Monster,LIGHT,Thunder,2600,0,"This card cannot be Normal Summoned or Set. This card cannot be Special Summoned except by removing from play 2 ""Batteryman"" monsters from your Graveyard. Once per turn, you can remove from play 1 Thunder-Type monster from your Graveyard to destroy 1 monster and 1 Spell or Trap Card on the field."
Battleguard King,Effect Monster,EARTH,Warrior,3000,1100,"Once per turn: You can Tribute any number of Warrior-Type monsters, except this card; for each Tributed monster, this card gains 1 additional attack during each Battle Phase this turn."
Beast King Barbaros,Effect Monster,EARTH,Beast-Warrior,3000,1200,"You can Normal Summon/Set this card without Tributing, but its original ATK becomes 1900. You can Tribute 3 monsters to Tribute Summon this card. If you do: Destroy all cards your opponent controls."
Beast Machine King Barbaros Ur,Effect Monster,EARTH,Beast-Warrior,3800,1200,"You can Special Summon this card (from your hand) by banishing 1 Machine-Type monster and 1 Beast-Warrior-Type monster from your hand, field, and/or Graveyard. If this card attacks or is attacked, your opponent takes no battle damage."
Belial - Marquis of Darkness,Effect Monster,DARK,Fiend,2800,2400,"Your opponent cannot target any face-up monster you control, except ""Belial - Marquis of Darkness"", for an attack, or with Spell/Trap effects."
Berserk Dragon,Effect Monster,DARK,Zombie,3500,0,"Cannot be Normal Summoned/Set. Must be Special Summoned with ""A Deal with Dark Ruler"" and cannot be Special Summoned by other ways. This card can attack all monsters your opponent controls once each. During each of your End Phases, this card loses 500 ATK."
Berserkion the Electromagna Warrior,Effect Monster,EARTH,Rock,3000,2800,"Cannot be Normal Summoned/Set. Must first be Special Summoned (from your hand) by banishing 1 ""Alpha The Electromagnet Warrior"", ""Beta The Electromagnet Warrior"", and ""Gamma The Electromagnet Warrior"" from your hand, Graveyard, and/or face-up from your Monster Zone. You can banish 1 Level 4 or lower ""Magnet Warrior"" monster from your Graveyard, then target 1 card your opponent controls; destroy it. If this card is destroyed by battle, or if this card in its owner's possession is destroyed by an opponent's card effect: You can target 1 each of your banished ""Alpha The Electromagnet Warrior"", ""Beta The Electromagnet Warrior"", and ""Gamma The Electromagnet Warrior""; Special Summon them."
Black Luster Soldier - Envoy of the Beginning,Effect Monster,LIGHT,Warrior,3000,2500,"Cannot be Normal Summoned/Set. Must first be Special Summoned (from your hand) by banishing 1 LIGHT and 1 DARK monster from your Graveyard. Once per turn, you can activate 1 of these effects."
,,,,,,Target 1 monster on the field: banish that target face-up. This card cannot attack the turn you activate this effect.
,,,,,,"During the Damage Step, if this attacking card destroys an opponent's monster by battle: It can make a second attack in a row."
Black Luster Soldier - Sacred Soldier,Effect Monster,LIGHT,Warrior,3000,2500,"When this card is Normal or Special Summoned: You can target 1 of your banished LIGHT or DARK monsters and 1 card your opponent controls; return that banished card to the Graveyard, and if you do, banish that card your opponent controls. You can only use this effect of ""Black Luster Soldier - Sacred Soldier"" once per turn. When this card destroys an opponent's monster by battle: You can target 1 Level 7 or lower Warrior-Type monster in your Graveyard; add it to your hand."
Blizzard Princess,Effect Monster,WATER,Spellcaster,2800,2100,"You can Tribute Summon this card in face-up Attack Position by Tributing 1 Spellcaster-Type monster. After this card was Normal Summoned, your opponent cannot activate Spell/Trap Cards for the rest of that turn."
Block Dragon,Effect Monster,EARTH,Rock,2500,3000,"Cannot be Normal Summoned/Set. Must be Special Summoned (from your hand orGraveyard) by banishing 3 EARTH monsters from your hand and/or Graveyard, and cannot be Special Summoned by other ways. Rock-Type monsters you control cannot be destroyed, except by battle. If this card is sent from the field to the Graveyard: You can add up to 3 Rock-Type monsters from your Deck to your hand, whose total Levels equal 8. You can only use this effect of ""Block Dragon"" once per turn."
Blue-Eyes Alternative White Dragon,Effect Monster,LIGHT,Dragon,3000,2500,"Cannot be Normal Summoned/Set. Must first be Special Summoned (from your hand) by revealing ""Blue-Eyes White Dragon"" in your hand. You can only Special Summon ""Blue-Eyes Alternative White Dragon"" once per turn this way. This card's name becomes ""Blue-Eyes White Dragon"" while it is on the field or in the Graveyard. Once per turn: You can target 1 monster your opponent controls; destroy it. This card cannot attack the turn this effect is activated."
Blue-Eyes Solid Dragon,Effect Monster,LIGHT,Dragon,2500,2000,"If this card is Normal or Special Summoned: You can target 1 face-up monster your opponent controls; negate its effects. When your opponent activates a card or effect (Quick Effect): You can shuffle this card from the field into the Deck, and if you do, Special Summon 1 ""Blue-Eyes White Dragon"" from your Deck. You can only use each effect of ""Blue-Eyes Solid Dragon"" once per turn."
Bonfire Colossus,Effect Monster,FIRE,Beast-Warrior,2600,2200,"If you control a FIRE monster, you can Special Summon this card (from your hand). When this card is Special Summoned: Target 2 FIRE monsters you control; destroy those targets."
Boot-Up Admiral - Destroyer Dynamo,Effect Monster,EARTH,Machine,2500,2500,"Cannot be Normal Summoned/Set. Must be Special Summoned (from your hand) by sending 2 ""Gadget"" Monster Cards from your hand and/or face-up field to the GY. Cannot be destroyed by battle or card effects while you control a ""Gadget"" monster or a ""Gadget"" Monster Card equipped to a monster. Once per turn: You can target 1 other card on the field; destroy it."
Caius the Mega Monarch,Effect Monster,DARK,Fiend,2800,1000,"You can Tribute Summon this card by Tributing 1 Tribute Summoned monster. If this card is Tribute Summoned: Target 1 card on the field; banish it, and if you do, inflict 1000 damage to your opponent, then, if it is a DARK Monster Card, banish all cards with that name from the hand, Main Deck, Extra Deck, and Graveyard of the player who controlled it. If this card was Tribute Summoned by Tributing a DARK monster, add this additional effect."
,,,,,,"You can target 2 cards, instead."
Cataclysmic Crusted Calcifida,Effect Monster,EARTH,Fairy,2600,200,"If a face-up EARTH monster(s) you control is destroyed by battle or an opponent's card effect: You can Special Summon this card from your hand, then, you can send 1 monster from your Deck to the GY. You can only use this effect of ""Cataclysmic Crusted Calcifida"" once per turn."
Cataclysmic Cryonic Coldo,Effect Monster,WIND,Fairy,2600,200,"If a face-up WIND monster(s) you control is destroyed by battle or an opponent's card effect: You can Special Summon this card from your hand, then, you can place 1 Spell/Trap from the field on top of the Deck. You can only use this effect of ""Cataclysmic Cryonic Coldo"" once per turn."
Cataclysmic Scorching Sunburner,Effect Monster,FIRE,Fairy,2600,200,"If a face-up FIRE monster(s) you control is destroyed by battle or an opponent's card effect: You can Special Summon this card from your hand, then, you can inflict damage to your opponent equal to half the ATK of 1 of those destroyed FIRE monsters in your GY. You can only use this effect of ""Cataclysmic Scorching Sunburner"" once per turn."
Chaos Dragon Levianeer,Effect Monster,DARK,Dragon,3000,0,"Cannot be Normal Summoned/Set. Must first be Special Summoned (from your hand) by banishing 3 LIGHT and/or DARK monsters from your GY. When Summoned this way: You can apply this effect, based on the Attribute(s) of monsters banished for the Special Summon, also this card cannot attack for the rest of this turn."
,,,,,,Only LIGHT: Special Summon 1 monster from your GY in Defense Position.
,,,,,,Only DARK: Shuffle 1 random card from your opponent's hand into the Deck.
,,,,,,Both LIGHT and DARK: Destroy up to 2 cards on the field.
,,,,,,"You can only use this effect of ""Chaos Dragon Levianeer"" once per turn."
Chaos Emperor Dragon - Envoy of the End,Effect Monster,DARK,Dragon,3000,2500,"Cannot be Normal Summoned/Set. Must first be Special Summoned (from your hand) by banishing 1 LIGHT and 1 DARK monster from your Graveyard. You can pay 1000 Life Points; send all cards in both players' hands and on the field to the Graveyard, then inflict 300 damage to your opponent for each card sent to the Graveyard by this effect."
"Chirubime, Princess of Autumn Leaves",Effect Monster,EARTH,Plant,1800,2800,"Your opponent cannot target face-up Plant-Type monsters for attacks, except this one. If this card in your possession is sent to your Graveyard by your opponent's card (either by battle or by card effect): You can Special Summon 1 Plant-Type monster from your Deck, except ""Chirubime, Princess of Autumn Leaves""."
Clear Vice Dragon,Effect Monster,DARK,Dragon,?,0,"You are unaffected by the effects of ""Clear World"". If this card attacks an opponent's monster, the ATK of this card becomes twice the ATK of the attack target, during damage calculation only. If this card would be destroyed by an opponent's card effect, you can discard 1 card instead."
Cloudian - Eye of the Typhoon,Effect Monster,WIND,Aqua,3000,1000,"This card cannot be destroyed by battle. If this card is in face-up Defense Position, destroy it. When this card declares an attack change the battle position of all face-up monsters, except ""Cloudian"" monsters."
Coach Captain Bearman,Effect Monster,FIRE,Beast-Warrior,2600,2700,"You can Normal Summon this card without Tributing, but its original ATK becomes 1300. Once per turn: You can make all Level 4 Beast-Warrior-Type monsters you currently control become Level 8 until the End Phase. This card cannot be used as an Xyz Material for an Xyz Summon, except for the Xyz Summon of a FIRE Warrior-Type monster."
Cracking Dragon,Effect Monster,DARK,Machine,3000,0,"Cannot be destroyed by battle with a monster with equal or lower Level. When your opponent Normal or Special Summons exactly 1 monster (and no other monsters are Summoned) while this monster is on the field: You can make that monster lose ATK equal to its Level x 200 (until the end of this turn), and if you do, inflict damage to your opponent equal to the ATK lost by this effect."
Curse Necrofear,Effect Monster,DARK,Fiend,2800,2200,"Cannot be Normal Summoned/Set. Must be Special Summoned by a card effect. You can target 3 of your banished Fiend monsters; Special Summon this card from your hand, and if you do, shuffle those banished monsters into the Deck. During the End Phase, if this card is in the GY because it was destroyed in your Monster Zone by an opponent's card and sent there this turn: Special Summon this card from your GY, then, you can destroy cards your opponent controls, up to the number of face-up Spells/Traps you control with different names. You can only use each effect of ""Curse Necrofear"" once per turn."
Danger! Bigfoot!,Effect Monster,DARK,Beast,3000,0,"You can reveal this card in your hand; your opponent randomly chooses 1 card from your entire hand, then you discard the chosen card. Then, if the discarded card was not ""Danger! Bigfoot!"", Special Summon 1 ""Danger! Bigfoot!"" from your hand, and if you do, draw 1 card. If this card is discarded: You can target 1 face-up card your opponent controls; destroy it. You can only use this effect of ""Danger! Bigfoot!"" once per turn."
Danger! Ogopogo!,Effect Monster,DARK,Sea Serpent,1200,3000,"You can reveal this card in your hand; your opponent randomly chooses 1 card from your entire hand, then you discard the chosen card. Then, if the discarded card was not ""Danger! Ogopogo!"", Special Summon 1 ""Danger! Ogopogo!"" from your hand, and if you do, draw 1 card. If this card is discarded: You can send 1 ""Danger!"" card from your Deck to the GY, except ""Danger! Ogopogo!"". You can only use this effect of ""Danger! Ogopogo!"" once per turn."
Danger! Thunderbird!,Effect Monster,DARK,Winged Beast,2800,2400,"You can reveal this card in your hand; your opponent randomly chooses 1 card from your entire hand, then you discard the chosen card. Then, if the discarded card was not ""Danger! Thunderbird!"", Special Summon 1 ""Danger! Thunderbird!"" from your hand, and if you do, draw 1 card. If this card is discarded: You can target 1 Set card your opponent controls; destroy it. You can only use this effect of ""Danger! Thunderbird!"" once per turn."
Dark Horus,Effect Monster,DARK,Dragon,3000,1800,"Once per turn, if a Spell Card is activated during your opponent's Main Phase: You can target 1 Level 4 DARK monster in your Graveyard; Special Summon that target. You must control this face-up card to activate and to resolve this effect."
Dark Lucius LV8,Effect Monster,EARTH,Fiend,2800,900,"If this card was Special Summoned by the effect of ""Dark Lucius LV6"", your opponent's monsters that this card destroys by battle are removed from play, and their effects are negated."
Dark Magician of Chaos,Effect Monster,DARK,Spellcaster,2800,2600,"When this card is Normal or Special Summoned: You can target 1 Spell Card in your Graveyard; add that target to your hand. Banish any monster destroyed by battle with this card. If this face-up card would leave the field, banish it instead."
Dark Necrofear,Effect Monster,DARK,Fiend,2200,2800,"This card cannot be Normal Summoned or Set. This card can only be Special Summoned by removing from play 3 Fiend-Type monsters in your Graveyard. If this card is destroyed by battle, or by your opponent's card effect while it is a Monster Card, equip it to a monster your opponent controls during the End Phase of this turn. Take control of the equipped monster."
Dark Nephthys,Effect Monster,DARK,Winged Beast,2400,1600,"If this card is in your hand and there are 3 or more DARK monsters in your Graveyard, you can remove from play 2 of them to send it to the Graveyard. If this card is sent to the Graveyard by this effect, Special Summon it during your next Standby Phase. When this card is Special Summoned, destroy 1 Spell or Trap Card."
Dark Voltanis,Effect Monster,DARK,Fairy,2800,1400,"After 1 Counter Trap Card you control has been activated and has resolved, you can Tribute 1 DARK monster to Special Summon this card from your hand. If this card is Special Summoned in this way, destroy 1 card on the field."
"Darkest Diabolos, Lord of the Lair",Effect Monster,DARK,Dragon,3000,2000,"Your opponent cannot Tribute this face-up card on the field,and cannot target it with card effects. You can only use each of these effects of ""Darkest Diabolos, Lord of the Lair"" once per turn."
,,,,,,If a DARK monster(s) you control is Tributed (except during the Damage Step): You can Special Summon this card from your GY (if it was there when youTributed) or hand (even if not).
,,,,,,You can Tribute 1 DARK monster; your opponent places 1 card from their hand on either the top or bottom of their Deck.
Darklord Asmodeus,Effect Monster,DARK,Fairy,3000,2500,"Cannot be Special Summoned from the Deck or Graveyard. Once per turn: You can send 1 Fairy-Type monster from your Deck to the Graveyard. When this card you control is destroyed and sent to your Graveyard: Special Summon 1 ""Asmo Token"" (Fairy-Type/DARK/Level 5/ATK 1800/DEF 1300) and 1 ""Deus Token"" (Fairy-Type/DARK/Level 3/ATK 1200/DEF 1200). ""Asmo Token"" cannot be destroyed by card effects. ""Deus Token"" cannot be destroyed by battle."
Darklord Superbia,Effect Monster,DARK,Fairy,2900,2400,"When this card is Special Summoned from the Graveyard: You can target 1 Fairy-Type monster in your Graveyard, except ""Darklord Superbia""; Special Summon that target."
Darklord Zerato,Effect Monster,DARK,Fairy,2800,2300,"If you have 4 or more DARK monsters with different names in your Graveyard, you can Tribute Summon this card by Tributing 1 DARK monster. You can send 1 DARK monster from your hand to the Graveyard; destroy all monsters your opponent controls. During the End Phase, if this card activated this effect this turn: Destroy this card."
Despair from the Dark,Effect Monster,DARK,Zombie,2800,3000,When this card is sent from your hand or Deck to your Graveyard by an opponent's card effect: Special Summon this card.
Desperado Barrel Dragon,Effect Monster,DARK,Machine,2800,2200,"If a face-up DARK Machine monster(s) you control is destroyed by battle or card effect: You can Special Summon this card from your hand. Once per turn, during the Battle Phase (Quick Effect): You can toss a coin 3 times; destroy face-up monsters on the field, up to the number of Heads, then if the result is 3 heads, draw 1 card. This card cannot attack the turn this effect is activated. If this card is sent to the GY: You can add 1 Level 7 or lower monster that has a coin tossing effect, from your Deck to your hand."
Destiny HERO - Dogma,Effect Monster,DARK,Warrior,3400,2400,"Cannot be Normal Summoned or Set. Must be Special Summoned (from your hand) by Tributing 3 monsters, including at least 1 ""Destiny HERO"" monster, and cannot be Special Summoned by other ways. If you still control this face-up card during your opponent's next Standby Phase after you Special Summoned it: Halve your opponent's Life Points."
Destiny HERO - Dreadmaster,Effect Monster,DARK,Warrior,?,?,"If this card is Special Summoned by ""Clock Tower Prison"": Destroy all monsters you control, except face-up ""Destiny HERO"" monsters, then you can Special Summon up to 2 ""Destiny HERO"" monsters from your Graveyard. During any turn this card is Special Summoned, ""Destiny HERO"" monsters you control cannot be destroyed, and you take no Battle Damage when they battle. The ATK and DEF of this card are equal to the combined original ATK of all other ""Destiny HERO"" monsters you control."
Destiny HERO - Plasma,Effect Monster,DARK,Warrior,1900,600,"Cannot be Normal Summoned or Set. Must be Special Summoned (from your hand) by Tributing 3 monsters you control, and cannot be Special Summoned by other ways. Negate the effects of all face-up monsters your opponent controls. Once per turn: You can target 1 monster your opponent controls; equip that target to this card, and this card gains ATK equal to half the ATK of that equipped monster (you can only equip 1 monster at a time to this card with this effect)."
Divine Dragon Lord Felgrand,Effect Monster,LIGHT,Dragon,2800,2800,"If this card is Special Summoned from the Graveyard: You can target 1 monster your opponent controls or in their Graveyard; banish it, and if you do, this card gains ATK and DEF equal to the banished monster's original Level/Rank x 100. If this card destroys an opponent's monster by battle: You can target 1 Level 7 or 8 Dragon-Type monster in the Graveyard, except ""Divine Dragon Lord Felgrand""; Special Summon it to your field."
Dododo Swordsman,Effect Monster,EARTH,Warrior,0,3000,"While this Flip Summoned card is face-up on the field, it gains 3500 ATK. When this card is flipped face-up: You can target up to 2 face-up monsters on the field; destroy them."
"Dogoran, the Mad Flame Kaiju",Effect Monster,FIRE,Dinosaur,3000,1200,"You can Special Summon this card (from your hand) to your opponent's side of the field in Attack Position, by Tributing 1 monster they control. If your opponent controls a ""Kaiju"" monster, you can Special Summon this card (from your hand) in Attack Position. You can only control 1 ""Kaiju"" monster. Once per turn: You can remove 3 Kaiju Counters from anywhere on the field; destroy all monsters your opponent controls. This card cannot attack the turn you activate this effect."
