Card Name,Type,Attribute   ,Sub Type    ,ATK    ,DEF    ,Card Text
,,,,,,"Pendulum Effect: Once per turn, if your opponent controls a monster whose current ATK is higher than its original ATK: You can gain 1000 LP."
Performapal Odd-Eyes Dissolver,Pendulum/Effect Monster,DARK,Spellcaster,2000,2600,"At the start of the Damage Step, if your Pendulum Monster battles an opponent's monster: You can Special Summon this card from your hand, and if you do, your monster cannot be destroyed by that battle. You can only use this effect of ""Performapal Odd-Eyes Dissolver"" once per turn. During your Main Phase: You can Fusion Summon 1 Fusion Monster from your Extra Deck, using this card you controlas Fusion Material, as well as other monsters you control or cards in your Pendulum Zones."
,,,,,,
,,,,,,Pendulum Scale: 4
,,,,,,"Pendulum Effect: Once per turn: You can Fusion Summon 1 Dragon Fusion Monster from your Extra Deck, using monsters from your hand or field as Fusion Materials."
Performapal Smile Sorcerer,Pendulum/Effect Monster,LIGHT,Spellcaster,2500,2000,"If this card is Normal or Special Summoned: You can add 1 ""Smile"" Spell/Trap from your Deck to your hand. If every monster you control is a ""Performapal"" or ""Odd-Eyes"" monster, or a ""Magician"" Pendulum Monster, and this card's current ATK is higher than its original ATK: You can draw cards equal to the number of monsters you control whose current ATK is higher than their original ATK, also you cannot Special Summon monsters for the rest of this turn. You can only use each monster effect of ""Performapal Smile Sorcerer"" once per turn."
,,,,,,
,,,,,,Pendulum Scale: 1
,,,,,,"Pendulum Effect: If a monster(s) you control whose current ATK is higher than its original ATK is destroyed by battle or card effect: You can Special Summon this card from your Pendulum Zone. You can only use this effect of ""Performapal Smile Sorcerer"" once per turn."
Qliphort Shell,Pendulum/Effect Monster,EARTH,Machine,2800,1000,"You can Normal Summon this card without Tributing. If this card is Normal Summoned without Tributing or is Special Summoned, its Level becomes 4 and its original ATK becomes 1800. If this card is Normal Summoned/Set, it is unaffected by activated effectsfrom any monster whose original Level/Rank is lower than this card's current Level. If this card is Normal Summoned by Tributing a ""Qli"" monster(s), it can make a second attack during each Battle Phase, and if it attacks a Defense Position monster, inflict piercing battle damageto your opponent."
,,,,,,
,,,,,,Pendulum Scale: 9
,,,,,,"Pendulum Effect: You cannot Special Summon monsters, except ""Qli"" monsters. This effect cannot be negated. All monsters your opponent controls lose 300 ATK."
Qliphort Stealth,Pendulum/Effect Monster,EARTH,Machine,2800,1000,"You can Normal Summon this card without Tributing. If this card is Normal Summoned without Tributing, or is Special Summoned, its Level becomes 4 and its original ATK becomes 1800. If this card is Normal Summoned/Set, it is unaffected by activated effects from any monster whose original Level/Rank is lower than this card's current Level. When this card is Tribute Summoned by Tributing a ""Qli"" monster(s): You can target 1 card on the field; return it to the hand. Your opponent cannot activate cards or effects in response to this effect's activation."
,,,,,,
,,,,,,Pendulum Scale: 1
,,,,,,"Pendulum Effect: You cannot Special Summon monsters, except ""Qli"" monsters. This effect cannot be negated. All ""Qli"" monsters you control gain 300 ATK."
Superheavy Samurai General Jade,Pendulum/Effect Monster,EARTH,Machine,1800,2800,"You can Tribute Summon this card by Tributing 1 ""Superheavy Samurai"" monster. When this card is Normal or Special Summoned: You can change its battle position. This card can attack while in face-up Defense Position. If it does, apply its DEF for damage calculation."
,,,,,,
,,,,,,Pendulum Scale: 1
,,,,,,"Pendulum Effect: You cannot Pendulum Summon monsters, except ""Superheavy Samurai"" monsters. This effect cannot be negated. Once per turn: You can target 1 ""Superheavy Samurai"" monster you control; increase its Level by 1 (even if this card leaves the field)."
Supreme King Dragon Odd-Eyes,Pendulum/Effect Monster,DARK,Dragon,2500,2000,"You can Tribute 2 ""Supreme King Dragon"" monsters; Special Summon this card from your hand. If your Pendulum Monster battles an opponent's monster, any battle damage it inflicts to your opponent is doubled. During the Battle Phase (Quick Effect): You can Tribute this card; Special Summon up to 2 face-up""Supreme King Dragon"" and/or ""Supreme King Gate"" Pendulum Monsters from your Extra Deck in Defense Position, except ""Supreme King Dragon Odd-Eyes""."
,,,,,,
,,,,,,Pendulum Scale: 4
,,,,,,"Pendulum Effect: You can Tribute 1 ""Supreme King Dragon"" monster; destroy this card, and if you do, add 1 Pendulum Monster with 1500 or less ATK from your Deck to your hand."
Black Luster Soldier,Ritual Monster,EARTH,Warrior,3000,2500,"This monster can only be Ritual Summoned with the Ritual Spell Card, ""Black Luster Ritual""."
Crab Turtle,Ritual Monster,WATER,Aqua,2550,2500,"This monster can only be Ritual Summoned with the Ritual Magic Card, ""Turtle Oath"". You must also offer monsters whose total Level Stars equal 8 or more as a Tribute form your Field or your hand."
Javelin Beetle,Ritual Monster,EARTH,Insect,2450,2550,"This card can only be Ritual Summoned with the Ritual Spell Card, ""Javelin Beetle Pact""."
Magician of Black Chaos,Ritual Monster,DARK,Spellcaster,2800,2600,"This card can only be Ritual Summoned with the Ritual Spell Card, ""Black Magic Ritual""."
The Masked Beast,Ritual Monster,DARK,Fiend,3200,1800,"This monster can only be Ritual Summoned with the Ritual Spell Card, ""Curse of the Masked Beast"". You must also offer monsters whose total Level Stars equal 8 or more as a Tribute from the field or your hand."
Zera the Mant,Ritual Monster,DARK,Fiend,2800,2300,"This card can only be Ritual Summoned with the Ritual Spell Card, ""Zera Ritual""."
"Amorphactor Pain, the Imagination Dracoverlord",Ritual/Effect Monster,EARTH,Dragon,2950,2500,"You can Ritual Summon this card with ""Amorphous Persona"". If this card is Ritual Summoned: Your opponent skips their next Main Phase 1. Negate the effects of face-up Fusion, Synchro, and Xyz Monsters while they are on the field. If this card is sent from the field to the Graveyard: You can add 1 ""Dracoverlord"" monster from yourDeck to your hand, except ""Amorphactor Pain, the Imagination Dracoverlord""."
Black Luster Soldier - Super Soldier,Ritual/Effect Monster,EARTH,Warrior,3000,2500,"You can Ritual Summon this card with ""Super Soldier Ritual"". If this card destroys an opponent's monster by battle and sends it to the Graveyard: Inflict damage to your opponent equal to its ATK in the Graveyard. If this card is destroyed by battle and sent to the Graveyard, or if this card in your possession is destroyed by an opponent's card effect and sent to your Graveyard: You can Special Summon 1 ""Gaia The Fierce Knight"" monster from your hand, Deck, or Graveyard. You can only Special Summon ""Black Luster Soldier - Super Soldier(s)"" once per turn."
Blue-Eyes Chaos Dragon,Ritual/Effect Monster,DARK,Dragon,3000,0,"You can Ritual Summon this card with ""Chaos Form"". Must be Ritual Summoned. Your opponent cannot target this card with card effects, also it cannot be destroyed by your opponent's card effects. If this Ritual Summoned card using a ""Blue-Eyes White Dragon"", when it declares an attack: You can change the battle positions of as many monsters your opponent controls as possible, and if you do, the ATK/DEF of those changed monsters become 0, also, this turn, if this card attacks a Defense Position monster, inflict piercing battle damage."
Blue-Eyes Chaos MAX Dragon,Ritual/Effect Monster,DARK,Dragon,4000,0,"You can Ritual Summon this card with ""Chaos Form"". Must be Ritual Summoned, and cannot be Special Summoned by other ways. Cannot be targeted, or destroyed by, your opponent's card effects. If this card attacks a Defense Position monster, inflict double piercing battle damage to your opponent."
Cerulean Sacred Phoenix of Nephthys,Ritual/Effect Monster,FIRE,Winged Beast,3000,1000,"You can Ritual Summon this card with ""Rebirth of Nephthys"". You can only use each of the following effects of ""Cerulean Sacred Phoenix of Nephthys"" once per turn."
,,,,,,"During your Main Phase: You can destroy ""Nephthys"" cards in your hand and/or face-up field, then destroy an equal number of monsters your opponent controls."
,,,,,,During your next Standby Phase after this card was destroyed by battle or card effect and sent to the GY: You can Special Summon this card from the GY.
Cyber Angel Dakini,Ritual/Effect Monster,LIGHT,Fairy,2700,2400,"You can Ritual Summon this card with ""Machine Angel Ritual"". If this card is Ritual Summoned: You can make your opponent send 1 monster they control to the Graveyard (their choice). If a Ritual Monster you control attacks a Defense Position monster, inflict piercing battle damage to your opponent. Once per turn, during your End Phase: You can target 1 Ritual Monster or 1 ""Machine Angel Ritual"" in your Graveyard; add it to your hand."
Cyber Angel Izana,Ritual/Effect Monster,LIGHT,Fairy,2500,2600,"You can Ritual Summon this card with ""Machine Angel Ritual"". If this card is Ritual Summoned: You can make your opponent send 1 Spell/Trap they control to the GY. When this attacking card destroys an opponent's monster by battle and sends it to the GY: You can activate this effect; this card can make a second attack on an opponent's monster in a row. Once per turn, when your opponent activates a card or effect that targets a ""Cyber Angel"" Ritual Monster(s) you control (Quick Effect): You can shuffle 1 Ritual Monster from your GY into the Deck, and if you do, destroy 1 card your opponent controls."
Dark Master - Zorc,Ritual/Effect Monster,DARK,Fiend,2700,1500,"You can Ritual Summon this card with ""Contract with the Dark Master"". Once per turn: You can roll 1 six-sided die, then destroy all monsters your opponent controls if you roll 1 or 2, destroy 1 monster your opponent controls if you roll 3, 4 or 5, or destroy all monsters you control if you roll 6."
"Demise, King of Armageddon",Ritual/Effect Monster,DARK,Fairy,2400,2000,"This card can only be Ritual Summoned with the Ritual Spell Card, ""End of the World"". By paying 2000 Life Points, destroy all cards on the field except this card."
Evigishki Levianima,Ritual/Effect Monster,WATER,Aqua,2700,1500,"You can Ritual Summon this card with any ""Gishki"" Ritual Spell Card. When this card declares an attack: Draw 1 card and reveal it. If the revealed card is a ""Gishki"" monster, look at 1 random card in your opponent's hand."
Evigishki Soul Ogre,Ritual/Effect Monster,WATER,Aqua,2800,2800,"Cannot be Normal Summoned or Set. Must first be Ritual Summoned. You can Ritual Summon this card with any ""Gishki"" Ritual Spell Card. Once per turn: You can discard 1 ""Gishki"" monster to target 1 face-up card your opponent controls; shuffle it into the Deck."
Litmus Doom Swordsman,Ritual/Effect Monster,DARK,Warrior,0,0,"You can Ritual Summon this card with ""Litmus Doom Ritual"". It is unaffected by Trap effects and cannot be destroyed by battle. Gains 3000 ATK/DEF while a Trap is on the field. If this Ritual Summoned card in its owner's control is destroyed by your opponent's card: You can target 1 Trap in either GY; Set it to your Spell & Trap Zone."
Lord of the Red,Ritual/Effect Monster,FIRE,Dragon,2400,2100,"You can Ritual Summon this card with ""Red-Eyes Transmigration"". Once per turn, during either player's turn, when a card or effect is activated, except ""Lord of the Red"": You can target 1 monster on the field; destroy it. Once per turn, during either player's turn, when a card or effect is activated, except ""Lord of the Red"": You can target 1 Spell/Trap Card on the field; destroy it."
Magician of Black Chaos MAX,Ritual/Effect Monster,DARK,Spellcaster,2800,2600,"You can Ritual Summon this card with ""Chaos Form"". If this card is Special Summoned: You can Tribute 1 monster; your opponent cannot activate monster effects this turn. When this card destroys an opponent's monster by battle: You can target 1 Spell in your GY; add it to your hand. You can only use each effect of ""Magician of Black Chaos MAX"" once per turn."
Megalith Aratron,Ritual/Effect Monster,EARTH,Rock,2000,3000,"You can Ritual Summon this card with a ""Megalith"" card. During the Main Phase (Quick Effect): You can discard this card; Ritual Summon 1 ""Megalith"" Ritual Monster from your hand, by Tributing monsters from your hand or field whose total Levels equal or exceed its Level. When your opponent activates a card or effect that targets a card you control (Quick Effect): You can place 1 Ritual Monster from your GY on the bottom of the Deck, and if you do, negate that activation, and if you do that, destroy it. You can only use each effect of ""Megalith Aratron"" once per turn."
Megalith Bethor,Ritual/Effect Monster,EARTH,Rock,1500,2600,"You can Ritual Summon this card with a ""Megalith"" card. You can discard this card; Ritual Summon 1 ""Megalith"" Ritual Monster from your hand, by Tributing monsters from your hand or field whose total Levels equal or exceed its Level. If this card is Ritual Summoned: You can target cards your opponent controls, up to the number of Ritual Monsters with different names in your GY; destroy them. You can only use each effect of ""Megalith Bethor"" once per turn."
Megalith Phaleg,Ritual/Effect Monster,EARTH,Rock,2500,1200,"You can Ritual Summon this card with a ""Megalith"" card. You can discard this card; Ritual Summon 1 ""Megalith"" Ritual Monster from your hand, by Tributing monsters from your hand or field whose total Levels equal or exceed its Level. You can only use this effect of ""Megalith Phaleg"" once per turn. Monsters you control gain 300 ATK/DEF for each Ritual Monster in your GY."
Nekroz of Valkyrus,Ritual/Effect Monster,WATER,Spellcaster,2900,1700,"You can Ritual Summon this card with any ""Nekroz"" Ritual Spell Card. Must be Ritual Summoned without using any Level 8 monsters, and cannot be Special Summoned by other ways. You can only use each of these effects of ""Nekroz of Valkyrus"" once per turn."
,,,,,,"When an opponent's monster declares an attack: You can banish 1 ""Nekroz"" card from your Graveyard and discard this card; negate the attack, then end the Battle Phase."
,,,,,,"During your Main Phase: You can Tribute up to 2 monsters from your hand and/or your side of the field, and if you do, draw the same number of cards you Tributed."
Reshef the Dark Being,Ritual/Effect Monster,LIGHT,Fiend,2500,1500,"This card can only be Ritual Summoned with the Ritual Spell Card, ""Final Ritual of the Ancients"". Discard 1 Spell Card from your hand. Take control of 1 monster on your opponent's side of the field until the End Phase. You can only use this effect once per turn."
Revendread Executor,Ritual/Effect Monster,DARK,Zombie,3000,0,"You can Ritual Summon this card with any ""Vendread"" Ritual Spell. This card's name becomes ""Revendread Slayer"" while on the field. While this Ritual Summoned card is on the field, your opponent cannot target cards you control with card effects, except this card. If this Ritual Summoned card is destroyed by battle, or is destroyed by an opponent's card effect while in its owner's Monster Zone: You can add 1 ""Vendread"" card from your Deck to your hand. You can only use this effect of ""Revendread Executor"" once per turn."
"Ruin, Queen of Oblivion",Ritual/Effect Monster,LIGHT,Fairy,2300,2000,"This card can only be Ritual Summoned with the Ritual Spell Card, ""End of the World"". If this card destroys your opponent's monster as a result of battle, it can attack once again in a row."
Salamangreat Emerald Eagle,Ritual/Effect Monster,FIRE,Cyberse,2800,2000,"You can Ritual Summon this card with ""Rise of the Salamangreat"". When this card is Ritual Summoned using ""Salamangreat Emerald Eagle"" you control: You can destroy all Special Summoned monsters your opponent controls. Once per turn: You can Tribute 1 ""Salamangreat"" Link Monster; this turn, this card gains this effect."
,,,,,,"At the start of the Damage Step, if this card battles an opponent's monster: Destroy that opponent's monster, and if you do, inflict damage to your opponent equal to that monster's original ATK."
"Shinato, King of a Higher Plane",Ritual/Effect Monster,LIGHT,Fairy,3300,3000,"This card can only be Ritual Summoned with the Ritual Spell Card, Shinato's Ark"". You must also Tribute monsters whose total Levels equal 8 or more from the field or your hand. When this card destroys a Defense Position monster and sends it to the Graveyard as a result of battle, inflict damage to your opponent's Life Points equal to the original ATK of the destroyed monster."""
"Vennu, Bright Bird of Divinity",Ritual/Effect Monster,LIGHT,Fairy,2800,2000,"You can Ritual Summon this card with ""Primal Cry"". Once per turn: You can reveal 1 monster in your hand, then target 1 face-up monster on the field; that target's Level becomes equal to the Level the revealed monster had, until the end of this turn. Once per turn, if another monster is Tributed from your hand or field (except during the Damage Step): You can target 1 monster in your Graveyard; add it to your hand."
Shinobaron Peacock,Ritual/Spirit/Effect Monster,WIND,Winged Beast,3000,2500,"You can Ritual Summon this card with ""Shinobird's Calling"". Must be Ritual Summoned, and cannot be Special Summoned by other ways. If this card is Ritual Summoned: You can return up to 3 monsters your opponent controls to the hand, then you can Special Summon 1 Level 4 or lower Spirit monster from your hand, ignoring its Summoning conditions. Once per turn, during the End Phase, if this card was Special Summoned this turn: Return it to the hand, and if you do, Special Summon 2 ""Shinobird Tokens"" (Winged Beast-Type/WIND/Level 4/ATK 1500/DEF 1500)."
Shinobaroness Peacock,Ritual/Spirit/Effect Monster,WIND,Winged Beast,2500,3000,"You can Ritual Summon this card with ""Shinobird's Calling"". Must be Ritual Summoned, and cannot be Special Summoned by other ways. If this card is Ritual Summoned: You can shuffle up to 3 Spell/Trap Cards your opponent controls into the Deck, then you can Special Summon 1 Level 4 or lower Spirit monster from your Deck, ignoring its Summoning conditions. Once per turn, during the End Phase, if this card was Special Summoned this turn: Return it to the hand, and if you do, Special Summon 2 ""Shinobird Tokens"" (Winged Beast-Type/WIND/Level 4/ATK 1500/DEF 1500)."
Hino-Kagu-Tsuchi,Spirit Monster,FIRE,Pyro,2800,2900,"This card cannot be Special Summoned. This card returns to the owner's hand during the End Phase of the turn that this card is Normal Summoned, Flip Summoned or flipped face-up. If this card inflicts Battle Damage to your opponent's Life Points, your opponent must discard all cards in his/her hand during the next Draw Phase before they draw."
Adamancipator Risen - Dragite,Synchro/Effect Monster,WATER,Rock,3000,2200,1 Tuner + 1+ non-Tuner monsters
,,,,,,"During your Main Phase: You can excavate the top 5 cards of your Deck, and if you do, you can return cards your opponent controls to the hand, up to the number of excavated Rock monsters, also place the excavated cards on the bottom of your Deck in any order. When your opponent activates a Spell/Trap Card or effect, while a WATER monster is in your GY (Quick Effect): You can negate the activation, and if you do, destroy it. You can only use each effect of ""Adamancipator Risen - Dragite"" once per turn."
Ally of Justice Light Gazer,Synchro/Effect Monster,DARK,Machine,2400,1600,1 Tuner + 1 or more non-Tuner monsters
,,,,,,This card gains 200 ATK for each LIGHT monster in your opponent's Graveyard.
Angel of Zera,Synchro/Effect Monster,LIGHT,Fairy,2800,2300,1 Tuner + 1 or more non-Tuner monsters
,,,,,,"This card gains 100 ATK for each of your opponent's banished cards. During the Standby Phase of the next turn after this card was banished: Special Summon this banished card. You can only use the effect of ""Angel of Zera"" once per turn."
Avenging Knight Parshath,Synchro/Effect Monster,LIGHT,Fairy,2600,2100,1 Tuner + 1 or more non-Tuner LIGHT monsters
,,,,,,"Once per turn, you can change the battle position of 1 face-up monster your opponent controls. During battle between this attacking card and a Defense Position monster whose DEF is lower than the ATK of this card, inflict the difference as Battle Damage to your opponent."
Battlewasp - Hama the Conquering Bow,Synchro/Effect Monster,WIND,Insect,2800,2000,1 Tuner + 1+ non-Tuner monsters
,,,,,,"If this card was Synchro Summoned using a Synchro Monster as material, it can make a second attack during each Battle Phase. You can only use each of the following effects of ""Battlewasp - Hama the Conquering Bow"" once per turn."
,,,,,,When this card inflicts battle damage to your opponent: You can make all monsters your opponent currently controls lose 1000 ATK/DEF.
,,,,,,"At the end of your Battle Phase, if your opponent has not taken any battle damage this Phase: You can inflict 300 damage to your opponent for each ""Battlewasp"" monster in your GY."
"Baxia, Brightness of the Yang Zing",Synchro/Effect Monster,LIGHT,Wyrm,2300,2600,1 Tuner + 1 or more non-Tuner Wyrm-Type monsters
,,,,,,"When this card is Synchro Summoned: You can target cards on the field, up to the number of different original Attributes of the Wyrm-Type monsters used for the Synchro Summon of this card; shuffle them into the Deck. Once per turn: You can target 1 card you control and 1 Level 4 or lower monster in your Graveyard; destroy that card on the field, and if you do, Special Summon that other monster from the Graveyard."
Beelze of the Diabolic Dragons,Synchro/Effect Monster,DARK,Dragon,3000,3000,1 DARK Tuner + 1 or more non-Tuner monsters
,,,,,,"Cannot be destroyed by battle or by card effects. When you take damage from an attack involving this card, or from an opponent's card effect: This card gains ATK equal to the damage you took."
Black Brutdrago,Synchro/Effect Monster,FIRE,Dragon,3000,2600,1 Tuner + 1 or more non-Tuner Gemini monsters
,,,,,,"Once per turn, you can send 1 Gemini monster from your hand to the Graveyard to select and destroy 1 Spell or Trap Card your opponent controls. When this card is destroyed and sent to the Graveyard, you can select 1 Gemini monster in your Graveyard and Special Summon it. The Special Summoned Gemini monster is treated as an Effect Monster, and gains its effect."
Black-Winged Dragon,Synchro/Effect Monster,DARK,Dragon,2800,1600,1 Tuner + 1 or more non-Tuner monsters
,,,,,,"Whenever you would take damage from a card effect, place 1 Black Feather Counter on this card instead. This card loses 700 ATK for each Black Feather Counter on it. Once per turn, you can remove all Black Feather Counters on this card to have 1 face-up monster your opponent controls lose 700 ATK for each Black Feather Counter, and inflict damage to your opponent equal to the ATK lost by that monster because of this effect."
Blackfeather Darkrage Dragon,Synchro/Effect Monster,DARK,Dragon,2600,1600,1 Tuner + 1 or more non-Tuner monsters
,,,,,,"Once per turn, when you take damage from an attack or a card effect: You can send up to 5 cards from the top of your Deck to the Graveyard, then if any monsters were sent to the Graveyard by this effect, this card gains 400 ATK."
Blackwing - Silverwind the Ascendant,Synchro/Effect Monster,DARK,Winged Beast,2800,2000,"1 ""Blackwing"" Tuner Monster + 2 or more non-Tuner monsters"
,,,,,,"When this card is Synchro Summoned, you can select and destroy up to 2 face-up monsters on the field with DEF lower than this card's ATK. You cannot conduct your Battle Phase the turn you activate this effect. The next time a ""Blackwing"" monster you control would be destroyed by battle during your opponent's turn, it is not destroyed; this effect only happens once."
Borreload Savage Dragon,Synchro/Effect Monster,DARK,Dragon,3000,2500,1 Tuner + 1+ non-Tuner monsters
,,,,,,"If this card is Synchro Summoned: You can equip 1 Link Monster from your GY to this card, and if you do, place Borrel Counters on this card equal to that Link Monster's Link Rating. This card gains ATK equal to half the ATK of the monster equipped to it by its effect. When your opponent activates a card or effect (Quick Effect): You can remove 1 Borrel Counter from this card; negate the activation. You can only use this effect of ""Borreload Savage Dragon"" once per turn."
Brotherhood of the Fire Fist - Kirin,Synchro/Effect Monster,FIRE,Beast-Warrior,2000,2800,"1 FIRE Tuner + 1 or more non-Tuner ""Fire Fist"" monsters"
,,,,,,"When this card is Synchro Summoned: You can Set 1 ""Fire Formation"" Spell/Trap Card directly from your Deck. All monsters your opponent controls lose 100 ATK for each face-up Spell/Trap Card you control."
Buster Dragon,Synchro/Effect Monster,DARK,Dragon,1200,2800,1 Tuner + 1 or more non-Tuner monsters
,,,,,,"All monsters your opponent controls become Dragon-Type. Once per turn, if you do not control a ""Buster Blader"" monster: You can target 1 ""Buster Blader"" in your Graveyard; Special Summon it. Once per turn, during your opponent's turn: You can target 1 ""Buster Blader"" monster you control; equip it with 1 ""Destruction Sword"" monster from your Graveyard (this is a Quick Effect)."
Chaos Goddess,Synchro/Effect Monster,LIGHT,Fairy,2500,1800,1 LIGHT Tuner + 2 or more non-Tuner DARK monsters
