Card Name,Type,Attribute   ,Sub Type    ,ATK    ,DEF    ,Card Text
Water Dragon,Effect Monster,WATER,Sea Serpent,2800,2600,"This card cannot be Normal Summoned or Set. This card cannot be Special Summoned except by the effect of ""Bonding - H2O"". While this card is face-up on the field, the ATK of FIRE monsters and Pyro-Type monsters become 0. When this card is destroyed and sent to the Graveyard, you can Special Summon 2 ""Hydrogeddon""s and 1 ""Oxygeddon"" from your Graveyard."
Wheel of Prophecy,Effect Monster,DARK,Spellcaster,2700,1700,"When this card is Special Summoned by the effect of a Spellcaster-Type monster: You can target any number of your banished ""Spellbook"" Spell Cards; shuffle them into the Deck, and if you do, return your other banished ""Spellbook"" Spell Cards to your Graveyard. You can only use the effect of ""Wheel of Prophecy"" once per turn."
White Night Dragon,Effect Monster,WATER,Dragon,3000,2500,"During either player's turn, when a Spell/Trap Card that targets this card is activated: Negate the activation, and if you do, destroy it. When a face-up monster you control is targeted for an attack: You can send 1 Spell/Trap Card you control to the Graveyard; change the target to this card."
Wicked Acolyte Chilam Sabak,Effect Monster,DARK,Reptile,2500,0,"If you have 5 or more cards in your hand, you can Normal Summon this card without Tributing. When this card is destroyed by battle and sent to the GY: You can Special Summon this card in Defense Position, and if you do, it is treated as a Tuner. You can only use this effect of ""Wicked Acolyte Chilam Sabak"" once per turn."
Windrose the Elemental Lord,Effect Monster,WIND,Winged Beast,2800,2200,"Cannot be Normal Summoned/Set. Must be Special Summoned (from your hand) by having exactly 5 WIND monsters in your Graveyard, and cannot be Special Summoned by other ways. When this card is Special Summoned: Destroy all Spell and Trap Cards your opponent controls. You can only use this effect of ""Windrose the Elemental Lord"" once per turn. If this card leaves the field, skip the Battle Phase of your next turn."
Witchcrafter Golem Aruru,Effect Monster,LIGHT,Spellcaster,2800,0,"When your opponent activates a card or effect that targets a Spellcaster monster(s) you control, or targets it for an attack (Quick Effect): You can target 1 card your opponent controls, or 1 ""Witchcrafter"" Spell in your GY; Special Summon this card from your hand, and if you do, return that targeted card to the hand. You can only use this effect of ""Witchcrafter Golem Aruru"" once per turn. Once per turn, during your opponent's Standby Phase: Return this card to the hand."
Witchcrafter Madame Verre,Effect Monster,LIGHT,Spellcaster,1000,2800,"During damage calculation, if your Spellcaster monster battles an opponent's monster (Quick Effect): You can reveal any number of Spells with different names in your hand, and if you do, your battling monster gains 1000 ATK/DEF for each card revealed, until the end of this turn. (Quick Effect): You can discard 1 Spell; negate the effects of all face-up monsters your opponent currently controls, until the end of this turn. You can only use each effect of ""Witchcrafter Madame Verre"" once per turn."
"World Legacy - ""World Lance""",Effect Monster,DARK,Machine,3000,0,"Monsters your opponent controls cannot attack ""World Legacy"" monsters you control, except this one. You can only use each of the following effects of ""World Legacy - ""World Lance"""" once per turn."
,,,,,,"During damage calculation, if a Link Monster battles a monster (Quick Effect): You can discard this card; the opponent's battling monster loses 3000 ATK."
,,,,,,"If a monster(s) is Special Summoned from the Extra Deck: Special Summon 1 ""World Legacy Token"" (Machine/DARK/Level 1/ATK 0/DEF 0) to both players' fields in Defense Position."
"World Legacy - ""World Wand""",Effect Monster,DARK,Machine,500,2500,"This Normal Summoned/Set card cannot be destroyed by battle with a monster Special Summoned from the Extra Deck. You can only use each of the following effects of ""World Legacy - ""World Wand"" once per turn."
,,,,,,"If this card is sent to the GY: You can Special Summon 1 ""World Legacy"" monster from your hand."
,,,,,,"You can banish this card from your GY, then target 1 of your banished ""Orcust"" monsters; Special Summon it, also you cannot Special Summon monsters for the rest of this turn, except DARK monsters"
Worm King,Effect Monster,LIGHT,Reptile,2700,1100,"This card can be Tribute Summoned in face-up Attack Position by Tributing 1 Reptile-Type ""Worm"" monster. You can Tribute 1 Reptile-Type ""Worm"" monster to select 1 card your opponent controls, and destroy it."
Worm Queen,Effect Monster,LIGHT,Reptile,2700,1100,"You can Tribute Summon this card in face-up Attack Position by Tributing 1 Reptile-Type ""Worm"" monster. Once per turn, you can Tribute 1 Reptile-Type ""Worm"" monster to Special Summon 1 Reptile-Type ""Worm"" monster from your Deck with a Level less than or equal to the Tributed monster."
Yellow Dragon Ninja,Effect Monster,WIND,Dinosaur,3000,1500,"Cannot be Special Summoned, except with the effect of a ""Ninja"" monster or ""Ninjitsu Art"" card. Once per turn (Quick Effect): You can send 1 ""Ninja"" monster and 1 ""Ninjitsu Art"" card from your hand and/or face-up from your field to the GY, then target up to 2 Spells/Traps on the field; destroy them."
Zaborg the Mega Monarch,Effect Monster,LIGHT,Thunder,2800,1000,"You can Tribute Summon this card by Tributing 1 Tribute Summoned monster. If this card is Tribute Summoned: Target 1 monster on the field; destroy it, then, if it was a LIGHT monster, both players send as many cards as possible from their Extra Deck to the Graveyard, but not more than the original Level/Rank of that destroyed monster. If this card was Tribute Summoned by Tributing a LIGHT monster, add this additional effect."
,,,,,,You choose the cards your opponent sends to the Graveyard.
Subterror Behemoth Phospheroglacier,Flip/Effect Monster,EARTH,Aqua,2600,2500,"FLIP: You can send 1 card from your Deck to the Graveyard. You can only use this effect of ""Subterror Behemoth Phospheroglacier"" once per turn."
,,,,,,"When a face-up monster you control is flipped face-down, if you control no face-up monsters: You can Special Summon this card from your hand in Defense Position. Once per turn: You can change this card to face-down Defense Position."
Gem-Knight Zirconia,Fusion Monster,EARTH,Rock,2900,2500,"1 ""Gem-Knight"" monster + 1 Rock-Type monster"
Meteor B. Dragon,Fusion Monster,FIRE,Dragon,3500,2000,"Red-Eyes B. Dragon + ""Meteor Dragon"""
ABC-Dragon Buster,Fusion/Effect Monster,LIGHT,Machine,3000,2800,"""A-Assault Core"" + ""B-Buster Drake"" + ""C-Crush Wyvern"""
,,,,,,"Must first be Special Summoned (from your Extra Deck) by banishing the above cards you control and/or from your Graveyard. (You do not use ""Polymerization"".) Once per turn, during either player's turn: You can discard 1 card, then target 1 card on the field; banish it. During your opponent's turn: You can Tribute this card, then target 3 of your banished LIGHT Machine-Type Union monsters with different names; Special Summon them (this is a Quick Effect)."
Amazoness Empress,Fusion/Effect Monster,EARTH,Warrior,2800,2400,"""Amazoness Queen"" + 1 ""Amazoness"" monster"
,,,,,,"Other ""Amazoness"" cards you control cannot be destroyed by battle or card effects. If your ""Amazoness"" monster attacks a Defense Position monster, inflict piercing battle damage to your opponent. If this face-up Fusion Summoned card is destroyed by battle, or leaves the field because of an opponent's card effect while its owner controls it: You can Special Summon 1 ""Amazoness Queen"" from your hand, Deck, or GY."
Amulet Dragon,Fusion/Effect Monster,DARK,Dragon,2900,2500,"""Dark Magician"" + 1 Dragon-Type monster."
,,,,,,"Must be Fusion Summoned with the above Fusion Material Monsters or with ""The Eye of Timaeus"", and cannot be Special Summoned by other ways. If this card is Special Summoned: Target any number of Spell Cards in any Graveyard(s) (min. 1); banish those targets, and if you do, this card gains 100 ATK for each card banished by this effect. If this card is destroyed: You can target 1 Spellcaster-Type monster in your Graveyard; Special Summon that target."
Ancient Gear Howitzer,Fusion/Effect Monster,EARTH,Machine,1000,1800,"2 ""Ancient Gear"" monsters"
,,,,,,"Unaffected by other cards' effects. During your Main Phase: You can inflict 1000 damage to your opponent. You can only use this effect of ""Ancient Gear Howitzer"" once per turn. If this card is destroyed by battle and sent to the Graveyard: You can Special Summon 1 ""Ancient Gear"" monster from your Deck, ignoring its Summoning conditions."
Beast-Eyes Pendulum Dragon,Fusion/Effect Monster,EARTH,Dragon,3000,2000,1 DARK Dragon-Type monster + 1 Beast-Type monster
,,,,,,"Must be either Fusion Summoned, or Special Summoned by Tributing the above cards you control (in which case you do not use ""Polymerization""), and cannot be Special Summoned by other ways. If this card destroys a monster by battle: Inflict damage to your opponent equal to the original ATK of the Beast-Type Fusion Material used for this card's Summon."
"Blaze Fenix, the Burning Bombardment Bird",Fusion/Effect Monster,FIRE,Pyro,2800,2300,1 Machine-Type monster + 1 Pyro-Type monster
,,,,,,"Once per turn, during your Main Phase: You can inflict 300 damage to your opponent for each card on the field. This card cannot attack during the turn you activate this effect."
Borreload Furious Dragon,Fusion/Effect Monster,DARK,Dragon,3000,2500,2 DARK Dragon monsters
,,,,,,"(Quick Effect): You can target 1 monster you control and 1 card your opponent controls; destroy them. You can banish this card from your GY, then target 1 DARK Link Monster in your GY; Special Summon it, but it cannot activate its effects this turn. You can only use each effect of ""Borreload Furious Dragon"" once per turn."
Brave-Eyes Pendulum Dragon,Fusion/Effect Monster,DARK,Dragon,3000,2000,"1 ""Pendulum Dragon"" monster + 1 Warrior-Type monster"
,,,,,,"When this card is Fusion Summoned: You can change the ATK of all face-up monsters your opponent currently controls to 0, also for the rest of this turn, other monsters you control cannot attack. Negate the activated effects of monsters with 0 ATK. At the end of the Damage Step, when this card attacks an opponent's monster, but the opponent's monster was not destroyed by the battle: You can banish that opponent's monster."
Brotherhood of the Fire Fist - Swan,Fusion/Effect Monster,FIRE,Beast-Warrior,2600,2200,2 Beast-Warrior monsters
,,,,,,"If this card is Special Summoned: You can inflict 200 damage to your opponent for each ""Fire Formation"" Spell/Trap you control. During the Battle Phase (Quick Effect): You can send 1 face-up ""Fire Formation"" Spell/Trap you control to the GY, then target 1 card your opponent controls; destroy it. You can only use each effect of ""Brotherhood of the Fire Fist - Swan"" once per turn."
"Buster Blader, the Dragon Destroyer Swordsman",Fusion/Effect Monster,LIGHT,Warrior,2800,2500,"1 ""Buster Blader"" + 1 Dragon-Type Monster"
,,,,,,"Must be Fusion Summoned and cannot be Special Summoned by other ways. This card cannot attack directly. This card gains 1000 ATK and DEF for each Dragon-Type monster your opponent controls or is in their Graveyard. Change all Dragon-Type monsters your opponent controls to Defense Position, also Dragon-Type monsters in your opponent's possession cannot activate their effects. If this card attacks a Defense Position monster, inflict piercing battle damage to your opponent."
Chimeratech Fortress Dragon,Fusion/Effect Monster,DARK,Machine,0,0,Cyber Dragon + 1 or more Machine-Type monsters
,,,,,,"This monster cannot be used as a Fusion Material Monster. You can only Special Summon this card from your Extra Deck by sending the above cards from either side of the field to the Graveyard. (You do not use ""Polymerization"".) The original ATK of this card is equal to 1000 x the number of Fusion Material Monsters used to Special Summon it."
Cyber Twin Dragon,Fusion/Effect Monster,LIGHT,Machine,2800,2100,"Cyber Dragon + ""Cyber Dragon"""
,,,,,,A Fusion Summon of this card can only be conducted with the above Fusion Material Monsters. This card can attack twice during each Battle Phase.
Cyberdark Dragon,Fusion/Effect Monster,DARK,Machine,1000,1000,"Cyberdark Horn + ""Cyberdark Edge"" + ""Cyberdark Keel"""
,,,,,,"This monster cannot be Special Summoned except by Fusion Summon. When this monster is Special Summoned, select 1 Dragon-Type monster in your Graveyard and equip it to this card. This card gains ATK equal to the equipped card's ATK. This card gains 100 ATK for each Monster Card in your Graveyard. If this card would be destroyed by battle, the equipped monster is destroyed instead."
D.3.S. Frog,Fusion/Effect Monster,WATER,Aqua,2500,2000,"Des Frog + ""Des Frog"" + ""Des Frog"""
,,,,,,"A Fusion Summon of this card can only be conducted with the above Fusion Material Monsters. Increase the ATK of this card by 500 points for each ""Treeborn Frog"" in your Graveyard."
D/D/D Dragonbane King Beowulf,Fusion/Effect Monster,DARK,Fiend,3000,2500,"1 ""D/D/D"" monster + 1 ""D/D"" monster"
,,,,,,"If a ""D/D"" monster you control attacks a Defense Position monster, inflict piercing battle damage to your opponent. Once per turn, during your Standby Phase: You can destroy all cards in the Spell & Trap Zones."
D/D/D Flame High King Genghis,Fusion/Effect Monster,FIRE,Fiend,2800,2400,"1 Level 5 or higher ""D/D"" monster + 1 ""D/D"" monster"
,,,,,,"If another ""D/D"" monster(s) is Normal or Special Summoned to your field while you control this monster (except during the Damage Step): You can target 1 ""D/D"" monster in your GY; Special Summon it. You can only use this effect of ""D/D/D Flame High King Genghis"" once per turn. Once per turn, during your turn, when a Spell/Trap Card, or its effect, is activated (Quick Effect): You can negate the activation."
Dark Cavalry,Fusion/Effect Monster,DARK,Spellcaster,2800,2300,"""Dark Magician"" + 1 Warrior monsters"
,,,,,,"Gains 100 ATK for each Spell/Trap on the field and in the GYs. If this card attacks a Defense Position monster, inflict piercing battle damage. When a card or effect is activated that targets a card on the field (Quick Effect): You can discard 1 card; negate the activation, and if you do, destroy it."
Dark Magician the Dragon Knight,Fusion/Effect Monster,DARK,Dragon,3000,2500,"""Dark Magician"" + 1 Dragon monster"
,,,,,,"This card's name becomes ""Dark Magician"" while on the field or in the GY. Your opponent cannot target Spells/Traps you control with card effects, also they cannot be destroyed by your opponent's card effects."
Dark Paladin,Fusion/Effect Monster,DARK,Spellcaster,2900,2400,"""Dark Magician"" + ""Buster Blader"""
,,,,,,"This card cannot be Special Summoned except by Fusion Summon. While this card is face-up on the field, you can discard 1 card to negate the activation of a Spell Card and destroy it. This card gains 500 ATK for each Dragon-Type monster on the field and in either player's Graveyard."
Destiny HERO - Dystopia,Fusion/Effect Monster,DARK,Warrior,2800,2400,"2 ""Destiny HERO"" monsters"
,,,,,,"If this card is Special Summoned: You can target 1 Level 4 or lower ""Destiny HERO"" monster in your Graveyard; inflict damage to your opponent equal to that target's ATK. During either player's turn, if this card's current ATK is different from its original ATK (except during the Damage Step): You can target 1 card on the field; destroy it, and if you do, this card's ATK becomes equal to this card's original ATK. You can only use each effect of ""Destiny HERO - Dystopia"" once per turn."
Destruction Dragon,Fusion/Effect Monster,FIRE,Dragon,2000,3000,"Must be Special Summoned with ""The Fang of Critias"", using ""Ring of Destruction"". Once per turn: You can target 1 card your opponent controls; destroy it. Then, if it was a Monster Card, inflict damage to your opponent equal to its original ATK."
"Dinoster Power, the Mighty Dracoslayer",Fusion/Effect Monster,WATER,Dragon,2000,2950,"1 ""Dracoslayer"" Pendulum Monster + 1 Pendulum Monster"
,,,,,,"Must first be Special Summoned (from your Extra Deck) by Tributing the above cards. (You do not use ""Polymerization"".) Pendulum Monster Cards in your Monster Zones and Pendulum Zones cannot be destroyed by battle or your opponent's card effects. Once per turn: You can Special Summon 1 ""Dracoslayer"" Pendulum Monster from your hand or Graveyard, but it cannot be used as a Fusion Material."
Dinowrestler Chimera T Wrextle,Fusion/Effect Monster,EARTH,Dinosaur,3500,0,"1 ""Dinowrestler"" Link Monster + 1 ""Dinowrestler"" monster"
,,,,,,"If this card battles, your opponent cannot activate Spell/Trap Cards until the end of the Damage Step. If this card attacks a Defense Position monster, inflict piercing battle damage. Your opponent's monsters cannot target monsters for attacks, except this one. If this card destroys a monster by battle: It gains 500 ATK. If this card is destroyed by card effect: Destroy all your opponent's Attack Position monsters."
Dragonecro Nethersoul Dragon,Fusion/Effect Monster,DARK,Dragon,3000,0,2 Zombie-Type monsters
,,,,,,"Must first be Fusion Summoned. Monsters cannot be destroyed by battle with this card. At the end of the Damage Step, if this card battled a monster that has an original Level: That monster's ATK becomes 0, also if that monster is still face-up on the field, Special Summon 1 ""Dark Soul Token"" (Zombie-Type/DARK/Level ?/ATK ?/DEF 0). (When Summoned, its Level and ATK become equal to the original Level and ATK of that monster.) You can only control 1 ""Dragonecro Nethersoul Dragon""."
El Shaddoll Construct,Fusion/Effect Monster,LIGHT,Fairy,2800,2500,"1 ""Shaddoll"" monster + 1 LIGHT monster"
,,,,,,"Must first be Fusion Summoned. If this card is Special Summoned: You can send 1 ""Shaddoll"" card from your Deck to the Graveyard. At the start of the Damage Step, if this card battles a Special Summoned monster: Destroy that monster. If this card is sent to the Graveyard: You can target 1 ""Shaddoll"" Spell/Trap Card in your Graveyard; add it to your hand."
Elemental HERO Absolute Zero,Fusion/Effect Monster,WATER,Warrior,2500,2000,"1 ""HERO"" monster + 1 WATER monster"
,,,,,,"Must be Fusion Summoned. Gains 500 ATK for each WATER monster on the field, except ""Elemental HERO Absolute Zero"". If this card leaves the field: Destroy all monsters your opponent controls."
Elemental HERO Escuridao,Fusion/Effect Monster,DARK,Warrior,2500,2000,"1 ""Elemental HERO"" monster + 1 DARK monster"
,,,,,,"Must be Fusion Summoned and cannot be Special Summoned by other ways. This card gains 100 ATK for each ""Elemental HERO"" monster in your Graveyard."
Elemental HERO Great Tornado,Fusion/Effect Monster,WIND,Warrior,2800,2200,"1 ""Elemental HERO"" monster + 1 WIND monster"
,,,,,,Must be Fusion Summoned and cannot be Special Summoned by other ways. When this card is Fusion Summoned: Halve the ATK and DEF of all face-up monsters your opponent controls.
Elemental HERO Inferno,Fusion/Effect Monster,FIRE,Pyro,2300,1600,"Elemental HERO Heat + ""Elemental HERO Lady Heat"""
,,,,,,"Must be Fusion Summoned and cannot be Special Summoned by other ways. If this card battles a WATER monster, this card gains 1000 ATK during the Damage Step only."
Elemental HERO Marine Neos,Fusion/Effect Monster,WATER,Warrior,2800,2300,"Elemental HERO Neos + ""Neo-Spacian Marine Dolphin"""
,,,,,,"Must first be Special Summoned (from your Extra Deck) by shuffling the above cards you control into the Deck. (You do not use ""Polymerization""). Once per turn: You can destroy 1 random card in your opponent's hand."
Elemental HERO Nova Master,Fusion/Effect Monster,FIRE,Warrior,2600,2100,"1 ""Elemental HERO"" monster + 1 FIRE monster"
,,,,,,Must be Fusion Summoned and cannot be Special Summoned in other ways. If this card destroys an opponent's monster by battle: Draw 1 card.
Elemental HERO Plasma Vice,Fusion/Effect Monster,EARTH,Warrior,2600,2300,"Elemental HERO Sparkman + ""Elemental HERO Bladedge"""
,,,,,,"Must be Fusion Summoned and cannot be Special Summoned by other ways. If this card attacks a Defense Position monster, inflict piercing Battle Damage to your opponent. You can discard 1 card to target 1 Attack Position monster your opponent controls; destroy that target."
Elemental HERO Shining Flare Wingman,Fusion/Effect Monster,LIGHT,Warrior,2500,2100,"Elemental HERO Flame Wingman + ""Elemental HERO Sparkman"""
,,,,,,"Must be Fusion Summoned and cannot be Special Summoned by other ways. This card gains 300 ATK for each ""Elemental HERO"" card in your Graveyard. When this card destroys a monster by battle and sends it to the Graveyard: Inflict damage to your opponent equal to the ATK of the destroyed monster in the Graveyard."
Elemental HERO Shining Phoenix Enforcer,Fusion/Effect Monster,FIRE,Warrior,2500,2100,"Elemental HERO Phoenix Enforcer + ""Elemental HERO Sparkman"""
,,,,,,"Must be Fusion Summoned and cannot be Special Summoned by other ways. This card gains 300 ATK for each ""Elemental HERO"" card in your Graveyard. This card cannot be destroyed by battle."
Elemental HERO Tempest,Fusion/Effect Monster,WIND,Warrior,2800,2800,"Elemental HERO Avian + ""Elemental HERO Sparkman"" + ""Elemental HERO Bubbleman"""
,,,,,,"Must be Fusion Summoned and cannot be Special Summoned by other ways. You can send 1 other card you control to the Graveyard to target 1 monster you control; while this card is face-up on the field, that monster cannot be destroyed by battle."
Elemental HERO Terra Firma,Fusion/Effect Monster,EARTH,Warrior,2500,2000,"Elemental HERO Ocean + ""Elemental HERO Woodsman"""
,,,,,,"Must be Fusion Summoned and cannot be Special Summoned by other ways. You can Tribute 1 face-up ""Elemental HERO"" monster; this card gains ATK equal to the Tributed monster's ATK, until the End Phase."
Elemental HERO The Shining,Fusion/Effect Monster,LIGHT,Warrior,2600,2100,"1 ""Elemental HERO"" monster + 1 LIGHT monster"
,,,,,,"Must be Fusion Summoned and cannot be Special Summoned by other ways. This card gains 300 ATK for each of your banished ""Elemental HERO"" monsters. When this card is sent from the field to the Graveyard: You can target up to 2 of your banished ""Elemental HERO"" monsters; add those targets to your hand."
Elemental HERO Wild Wingman,Fusion/Effect Monster,EARTH,Warrior,1900,2300,"Elemental HERO Wildheart + ""Elemental HERO Avian"""
,,,,,,Must be Fusion Summoned and cannot be Special Summoned by other ways. You can discard 1 card to target 1 Spell/Trap Card on the field; destroy that target.
Elemental HERO Wildedge,Fusion/Effect Monster,EARTH,Warrior,2600,2300,"Elemental HERO Wildheart + ""Elemental HERO Bladedge"""
,,,,,,Must be Fusion Summoned and cannot be Special Summoned by other ways. This card can attack every monster your opponent controls (one attack on each monster per Battle Phase).
Evil HERO Dark Gaia,Fusion/Effect Monster,EARTH,Fiend,?,0,1 Fiend-Type monster + 1 Rock-Type monster
,,,,,,"Must be Special Summoned with ""Dark Fusion"" and cannot be Special Summoned by other ways. The original ATK of this card is equal to the combined original ATK of the Fusion Material Monsters used to Fusion Summon it. When this card declares an attack: You can change all Defense Position monsters your opponent controls to face-up Attack Position. (Flip Effects are not activated at this time.)"
Evil HERO Malicious Bane,Fusion/Effect Monster,DARK,Fiend,3000,3000,"1 ""Evil HERO"" monster + 1 Level 5 or higher monster"
,,,,,,"Must be Special Summoned with ""Dark Fusion"". Cannot be destroyed by battle or card effects. During your Main Phase: You can destroy all monsters your opponent controls with ATK less than or equal to this card's, also this card gains 200 ATK for each monster destroyed this way, also you cannot declare an attack for the rest of this turn, except with ""HERO"" monsters. You can only use this effect of ""Evil HERO Malicious Bane"" once per turn."
Evil HERO Malicious Fiend,Fusion/Effect Monster,FIRE,Fiend,3500,2100,Evil HERO Malicious Edge + 1 Level 6 or higher Fiend-Type monster
,,,,,,"Must be Special Summoned with ""Dark Fusion"" and cannot be Special Summoned by other ways. During your opponent's Battle Phase, all monsters they control are changed to face-up Attack Position, and each monster they control must attack this card, if able."
Evil HERO Wild Cyclone,Fusion/Effect Monster,EARTH,Fiend,1900,2300,"Elemental HERO Avian + ""Elemental HERO Wildheart"""
,,,,,,"Must be Special Summoned with ""Dark Fusion"" and cannot be Special Summoned by other ways. If this card attacks, your opponent cannot activate any Spell/Trap Cards until the end of the Damage Step. When this card inflicts Battle Damage to your opponent: Destroy all face-down Spell and Trap Cards your opponent controls."
Frightfur Chimera,Fusion/Effect Monster,DARK,Fiend,2800,2000,"3 ""Frightfur"" monsters"
,,,,,,"Must be Fusion Summoned, and cannot be Special Summoned by other ways. If this card attacks or is attacked, your opponent cannot activate cards or effects until the end of the Damage Step. When this card destroys an opponent's monster by battle and sends it to the Graveyard: You can Special Summon that monster to your side of the field, but its ATK is halved. You can only use this effect of ""Frightfur Chimera"" once per turn. This card gains 300 ATK for each monster you control that is owned by your opponent."
Frightfur Daredevil,Fusion/Effect Monster,DARK,Fiend,3000,2200,"1 ""Edge Imp"" monster + 1 ""Fluffal"" monster"
